,Category,Term,Count,%,PValue,Genes,List Total,Pop Hits,Pop Total,Fold Enrichment,Bonferroni,Benjamini,FDR
52,GOTERM_CC_5,GO:0044295~axonal growth cone,7,0.9308510638297872,0.00038018356775696246,"OLFM1, EPHA4, APC, KIF5B, NRXN1, MAPT, MAPK8IP1",543,28,15239,7.016114180478821,0.1559926802295331,0.0031992805890491,0.002689978073752
53,GOTERM_CC_5,GO:0032809~neuronal cell body membrane,7,0.9308510638297872,0.0004651057175806653,"KCNC1, KCND2, KCNC2, HPCA, KCNA2, ATP2B2, RGS8",543,29,15239,6.774179208738172,0.1873748981364488,0.0038414287044625,0.0032299008165323
54,GOTERM_CC_5,GO:0044298~cell body membrane,7,0.9308510638297872,0.0005641038579439101,"KCNC1, KCND2, KCNC2, HPCA, KCNA2, ATP2B2, RGS8",543,30,15239,6.548373235113567,0.2224919714525235,0.004574369466236,0.0038461626677993
55,GOTERM_CC_5,GO:0005871~kinesin complex,9,1.196808510638298,0.0006785044499249351,"KLC2, KIF5C, KIF5B, KIF5A, KIF1B, KIF21A, KIF1A, KIF6, KIF4",543,55,15239,4.592365645404319,0.2611908850721024,0.0054038032976164,0.0045435565843187
56,GOTERM_CC_5,GO:0014731~spectrin-associated cytoskeleton,4,0.5319148936170213,0.0008257783787086127,"DMTN, ANK3, SPTB, ANK1",543,6,15239,18.709637814610197,0.3081937212684196,0.0064613536298954,0.005432752491504
57,GOTERM_CC_5,GO:0043194~axon initial segment,5,0.6648936170212766,0.0008756940457199121,"SPTBN4, KCNQ2, CCK, ANK3, SCN1A",543,13,15239,10.794021816121264,0.3234376361727261,0.006733785248122,0.0056618149507752
58,GOTERM_CC_5,GO:0030315~T-tubule,9,1.196808510638298,0.0012209183047115,"KCNJ5, KCND2, AKAP6, AQP4, KCNN2, ANK3, SLC8A1, KCNJ3, SCN1A",543,60,15239,4.209668508287293,0.4200783366606277,0.0092293146423958,0.0077600739706242
59,GOTERM_CC_5,GO:0043198~dendritic shaft,9,1.196808510638298,0.0013623361621585,"JPH4, GRIA2, GRM5, STAU2, SEZ6, CACNA1B, CNIH3, GRIA3, SLC8A1",543,61,15239,4.140657549135042,0.455570152689654,0.0101266988053784,0.0085146010134908
60,GOTERM_CC_5,GO:0099513~polymeric cytoskeletal fiber,41,5.452127659574469,0.0021570880676091,"STAU2, CRMP1, KRT23, JAKMIP1, SLC8A1, CRHBP, KLC2, TUBB3, KIF5C, KIF5B, TUBB1, KIF5A, NEFL, UPP2, KIF1B, KIF21A, NEFM, MAP4, KIF1A, TPPP, NEFH, DYNC1I1, CLASP2, KRT222, APC2, DMTN, SPAG5, MTUS2, DCLK2, KCNAB2, TUBB4A, KIF6, KIF4, DNM3, TTLL7, PCP4, MYO1B, APC, DCX, MAPT, INA",543,700,15239,1.6437753222836098,0.6182923960628879,0.0157714963631747,0.0132607873008756
61,GOTERM_CC_5,GO:0005892~acetylcholine-gated channel complex,5,0.6648936170212766,0.0026029974687884,"CHRNB2, CHRNA3, CHRNB3, CHRNA4, CHRNA6",543,17,15239,8.254251977033908,0.6872810628062405,0.0184275693822169,0.0154940325523124
62,GOTERM_CC_5,GO:0031045~dense core granule,5,0.6648936170212766,0.0026029974687884,"SYT4, CRHBP, SYT1, NCS1, SYT7",543,17,15239,8.254251977033908,0.6872810628062405,0.0184275693822169,0.0154940325523124
63,GOTERM_CC_5,GO:0005794~Golgi apparatus,67,8.909574468085106,0.0035093667382518,"TENM1, CNTNAP2, GALNT13, CLSTN2, ICA1, STMN3, RPH3A, SHH, PCLO, B3GALT2, NCS1, LIPG, RESP18, ENPP2, BSN, CALN1, APC2, EPHA4, RBFOX1, ST6GAL2, MYOC, PRKCE, APLP1, DUSP26, TMEM130, SYN1, F5, DNM3, INPP4B, OLFM3, B3GNT2, NECAB3, ATL1, CABP1, ZDHHC22, JAKMIP3, JAKMIP2, GOLGA7B, FUT9, MLANA, CLVS2, CHSY3, RAB6B, BEND5, SNCA, CLASP2, TFAP2A, SYT4, SYT1, ST8SIA2, B3GAT1, ST8SIA3, DDHD2, ATP2B3, GAD2, PDE4DIP, RAB27A, DHCR24, B3GALT5, GPR143, MYO1B, SYNDIG1L, NSG2, APBA1, GALNTL6, SCRG1, LGR5",543,1331,15239,1.4127111948672608,0.7915238011922829,0.0244558994571923,0.0205626957319442
64,GOTERM_CC_5,GO:0035253~ciliary rootlet,4,0.5319148936170213,0.004453290849158,"KLC2, KIF5C, KIF5B, KIF5A",543,10,15239,11.225782688766111,0.8633870294754371,0.030093450283704,0.0253027889156704
65,GOTERM_CC_5,GO:0044224~juxtaparanode region of axon,4,0.5319148936170213,0.004453290849158,"CNTNAP2, DLG2, KCNA2, KCNAB2",543,10,15239,11.225782688766111,0.8633870294754371,0.030093450283704,0.0253027889156704
66,GOTERM_CC_5,GO:0005891~voltage-gated calcium channel complex,6,0.7978723404255319,0.0066219359463459,"CACNA2D3, CACNA1B, CACNA1A, CACNG2, CACNA1E, CACNG4",543,34,15239,4.952551186220344,0.9483469159279184,0.0440803497323924,0.0370630743265631
67,GOTERM_CC_5,GO:0044316~cone cell pedicle,3,0.3989361702127659,0.0072231466258525,"PCLO, SLC32A1, RAPGEF4",543,4,15239,21.04834254143646,0.9605694544293928,0.0466887448569597,0.0392562316622419
68,GOTERM_CC_5,GO:0033269~internode region of axon,3,0.3989361702127659,0.0072231466258525,"MBP, TUBB4A, ERMN",543,4,15239,21.04834254143646,0.9605694544293928,0.0466887448569597,0.0392562316622419
69,GOTERM_CC_5,GO:0045009~chitosome,4,0.5319148936170213,0.007742571963383,"OCA2, GPR143, TYRP1, TYR",543,12,15239,9.354818907305097,0.96877776497337,0.0486364379671669,0.0408938660037838
70,GOTERM_CC_5,GO:0033162~melanosome membrane,4,0.5319148936170213,0.007742571963383,"OCA2, GPR143, TYRP1, TYR",543,12,15239,9.354818907305097,0.96877776497337,0.0486364379671669,0.0408938660037838
71,GOTERM_CC_5,GO:0044448~cell cortex part,12,1.5957446808510638,0.0078974494461329,"SPTBN4, SEPT6, DMTN, PCLO, ASPH, MOBP, BSN, SPTB, ANK1, RAPGEF3, CLASP2, CAP2",543,133,15239,2.532131433556266,0.9708775103122372,0.0489203118468789,0.0411325491986089
72,GOTERM_CC_5,GO:0042383~sarcolemma,13,1.7287234042553192,0.0085402069112468,"KCNJ5, KCND2, AKAP6, AQP4, ANK3, ATP1B1, ANK1, SLC8A1, PRKCQ, KCNN2, BVES, KCNJ3, SCN1A",543,153,15239,2.3845616822542404,0.9781878912510046,0.0521771545536452,0.0438709259139393
73,GOTERM_CC_5,GO:0099568~cytoplasmic region,21,2.792553191489361,0.0088559583665387,"SPTBN4, GRIA2, DMTN, GAD1, HPCA, SPTB, ANK1, ERMN, SEPT6, PCLO, APC, ASPH, MOBP, NEFL, KIF1B, ARHGEF7, BSN, RAPGEF3, SNCA, CLASP2, CAP2",543,314,15239,1.876922264841468,0.9810765015146438,0.053375100425355,0.0448781673980003
74,GOTERM_CC_5,GO:0044292~dendrite terminus,4,0.5319148936170213,0.0098026353388234,"SLC32A1, RGS11, MAPK8IP1, RGS7",543,13,15239,8.635217452897011,0.9876431520002944,0.05829300481487,0.0490131766941171
75,GOTERM_CC_5,GO:0030667~secretory granule membrane,9,1.196808510638298,0.0113723219286076,"PNLIPRP2, SYT4, PTPRN2, SYT1, ABHD2, ICA1, RAB27A, VAMP1, SNCA",543,86,15239,2.936978029037646,0.9939100575213878,0.0667375734231446,0.0561134305687875
76,GOTERM_CC_5,GO:0001518~voltage-gated sodium channel complex,4,0.5319148936170213,0.0121510701948093,"SCN3B, SCN4B, SCN3A, SCN1A",543,14,15239,8.018416206261511,0.9957147316329958,0.0703815234660386,0.0591772899097858
77,GOTERM_CC_5,GO:0005875~microtubule associated complex,12,1.5957446808510638,0.0152245243732185,"KLC2, KIF5C, KIF5B, KIF5A, KIF1B, KIF21A, KIF1A, MAPT, MAP4, KIF6, DYNC1I1, KIF4",543,146,15239,2.306667675773859,0.9989324157191666,0.0870530496212238,0.0731948287173967
78,GOTERM_CC_5,GO:0030863~cortical cytoskeleton,9,1.196808510638298,0.0186934776321012,"SPTBN4, DMTN, PCLO, MOBP, BSN, SPTB, ANK1, RAPGEF3, CAP2",543,94,15239,2.687022452098272,0.9997787467251432,0.1055353294166726,0.0887348621776956
79,GOTERM_CC_5,GO:0016323~basolateral plasma membrane,16,2.127659574468085,0.0210909444372388,"NDRG4, KCNC2, RASGRF1, SLC1A3, AQP4, LIN7A, ANK3, ATP1B1, SLC8A1, FXYD2, PALM, CAR9, SLC16A8, CTNNA2, RAPGEF3, RAPGEF4",543,235,15239,1.9107715214921048,0.9999256833141724,0.1175820152376068,0.0988638020495573
80,GOTERM_CC_5,GO:0005938~cell cortex,17,2.2606382978723407,0.0238624765738603,"SPTBN4, DMTN, GAD1, SPTB, ANK1, ERMN, SEPT6, PCLO, APC, ASPH, MOBP, ARHGEF7, BSN, RAPGEF3, SNCA, CLASP2, CAP2",543,260,15239,1.834983708740615,0.999979014978069,0.1313909203943422,0.1104744285826868
81,GOTERM_CC_5,GO:0030673~axolemma,4,0.5319148936170213,0.0283696871167909,"CNTNAP2, KCNC1, KCNC2, ANK1",543,19,15239,5.908306678297955,0.999997336389434,0.1543034201718144,0.1297394227902027
82,GOTERM_CC_5,GO:0032584~growth cone membrane,3,0.3989361702127659,0.0306646298316458,"LAMP5, GAP43, DCC",543,8,15239,10.52417127071823,0.9999990722503974,0.1608991165284004,0.1352851316102021
83,GOTERM_CC_5,GO:0030285~integral component of synaptic vesicle membrane,3,0.3989361702127659,0.0306646298316458,"GABRA2, ATP6V1G2, TMEM163",543,8,15239,10.52417127071823,0.9999990722503974,0.1608991165284004,0.1352851316102021
84,GOTERM_CC_5,GO:0098563~intrinsic component of synaptic vesicle membrane,3,0.3989361702127659,0.0306646298316458,"GABRA2, ATP6V1G2, TMEM163",543,8,15239,10.52417127071823,0.9999990722503974,0.1608991165284004,0.1352851316102021
85,GOTERM_CC_5,GO:0031201~SNARE complex,6,0.7978723404255319,0.0342662217820379,"NAPB, STX1B, SYT1, VAMP1, SYN2, CPLX1",543,51,15239,3.301700790813563,0.9999998236359122,0.1777062199394061,0.1494166647472584
86,GOTERM_CC_5,GO:0043292~contractile fiber,15,1.9946808510638296,0.0350880732001934,"NEBL, TMOD2, PDE4DIP, ANK3, ANK1, GRIN2B, SLC8A1, MYL4, ABLIM2, MYL2, KCNN2, SCN3B, TIMP4, SCN1A, CDK5R1",543,229,15239,1.838283191391831,0.9999998793568016,0.1798767890492674,0.1512416948284199
87,GOTERM_CC_5,GO:0034399~nuclear periphery,10,1.3297872340425532,0.0358839434860623,"SPTBN4, TENM1, SATB1, SATB2, PHACTR3, DNTT, MAPT, KPNB1, MEN1, ATF4",543,126,15239,2.227337835072642,0.9999999165022428,0.1818663499407252,0.152914531900834
88,GOTERM_CC_5,GO:0005783~endoplasmic reticulum,70,9.308510638297872,0.0379703664909194,"PCSK2, TENM1, CALR3, PCSK1, CLSTN2, CLGN, JPH4, GRIP1, SHH, JPH3, LRRTM1, RESP18, FAM19A1, LRAT, EPHA4, MYOC, KCND2, PRKCE, FBXO2, ELOVL6, ELOVL7, ANK3, SEZ6L, ANK1, MAPK8IP1, F5, FNDC5, CLDN10, OLFM1, ASPH, KCNMA1, RDH5, PGR, FAR2, NAT8L, KPNB1, GRIA2, OCA2, NDRG4, NECAB3, RTN1, KLHL14, STAU2, ATL1, NRXN1, KCNA2, SEZ6, AKAP6, ZDHHC22, SEZ6L2, GLRA1, CYP4X1, PCDHA1, MLANA, SPTSSB, KCNN2, SNCA, HHATL, NTRK2, PTPRN2, OSBPL6, TXNRD3, BDNF, B3GAT1, DHCR24, ATP2B2, B3GALT5, SGPP2, TTC9, CYP2S1",543,1572,15239,1.2496895486857953,0.999999968227701,0.190278465785956,0.1599874992594922
89,GOTERM_CC_5,GO:0044327~dendritic spine head,3,0.3989361702127659,0.0385112871813037,"DNM3, HPCA, SRGAP2",543,9,15239,9.354818907305097,0.9999999752765614,0.190844823142905,0.1604636965887654
90,GOTERM_CC_5,GO:0005834~heterotrimeric G-protein complex,5,0.6648936170212766,0.0450100664105478,"GNAL, GNG4, RGS11, GNG13, RGS7",543,38,15239,3.692691673936222,0.999999998799224,0.2205987870231245,0.1854810429006091
91,GOTERM_CC_5,GO:0016528~sarcoplasm,7,0.9308510638297872,0.0477574915515813,"JPH4, JPH3, ASPH, SPOCK1, AKAP6, ANK3, ANK1",543,74,15239,2.654745906127121,0.9999999996677892,0.2315200133913619,0.194663688389598
92,GOTERM_CC_5,GO:0030016~myofibril,14,1.8617021276595744,0.0496420761806436,"NEBL, TMOD2, PDE4DIP, ANK3, ANK1, GRIN2B, SLC8A1, MYL4, ABLIM2, MYL2, KCNN2, SCN3B, TIMP4, SCN1A",543,219,15239,1.7940748589352236,0.9999999998626936,0.2380684513609364,0.2001696620187245
93,GOTERM_CC_5,GO:0031984~organelle subcompartment,18,2.393617021276596,0.0504532132345075,"RBFOX1, NECAB3, ST6GAL2, ATL1, ICA1, MYO1B, PCLO, ASPH, NSG2, FUT9, MLANA, CLVS2, CHSY3, BSN, LGR5, KPNB1, CALN1, CLASP2",543,309,15239,1.634822721664968,0.9999999999061788,0.2393843947084081,0.2012761166270247
94,GOTERM_CC_5,GO:0030175~filopodium,8,1.0638297872340423,0.0683975429676059,"EPHA4, GAP43, MYO1B, PTPRZ1, RUFY3, PALM, ERMN, RAPGEF3",543,101,15239,2.222927265102201,0.9999999999999812,0.3147703194822915,0.2646611430624648
95,GOTERM_CC_5,GO:0048788~cytoskeleton of presynaptic active zone,2,0.2659574468085106,0.0698705417684907,"PCLO, BSN",543,2,15239,28.064456721915285,0.9999999999999908,0.3147703194822915,0.2646611430624648
96,GOTERM_CC_5,GO:0099569~presynaptic cytoskeleton,2,0.2659574468085106,0.0698705417684907,"PCLO, BSN",543,2,15239,28.064456721915285,0.9999999999999908,0.3147703194822915,0.2646611430624648
97,GOTERM_CC_5,GO:0098831~presynaptic active zone cytoplasmic component,2,0.2659574468085106,0.0698705417684907,"PCLO, BSN",543,2,15239,28.064456721915285,0.9999999999999908,0.3147703194822915,0.2646611430624648
98,GOTERM_CC_5,GO:1990742~microvesicle,2,0.2659574468085106,0.0698705417684907,"SYT4, PPFIA3",543,2,15239,28.064456721915285,0.9999999999999908,0.3147703194822915,0.2646611430624648
99,GOTERM_CC_5,GO:0005856~cytoskeleton,85,11.303191489361703,0.0776720692845163,"TENM1, ELAVL4, KRT23, SLC8A1, RPH3A, TRIM9, CRHBP, SEPT6, PCLO, TUBB3, KIF5C, KIF5B, KIF5A, TUBB1, NEFL, KIF1B, KIF21A, UPP2, NEFM, KIF1A, BSN, NEFH, TRIM67, KRT222, APC2, PRKCE, TMOD2, MTUS2, ANK3, KCNAB2, SPTB, ANK1, KIF6, ERMN, KIF4, SEPT3, DNM3, MYL4, KAT2A, FRMD5, PCP4, DAAM1, MYL2, MAP7D2, DCX, TLN2, MAPT, RPP25, INA, RAPGEF3, ATF4, SPTBN4, STAU2, CRMP1, JAKMIP1, ADD2, KLC2, ABLIM2, MOBP, SNTG1, MAP4, CTNNA2, TPPP, CCDC141, DYNC1I1, SNCA, CAP2, CLASP2, TFAP2A, DMTN, SPAG5, NEBL, DDHD2, MYBPH, KLHL1, PDE4DIP, DCLK2, DHCR24, TUBB4A, MYO16, TTLL7, MYO1B, DAB1, APC, 2900011O08RIK",543,2032,15239,1.1739561128753933,0.9999999999999998,0.3464174290089428,0.2912702598169362
100,GOTERM_CC_5,GO:0048770~pigment granule,8,1.0638297872340423,0.083678632047197,"OCA2, GPR143, ATP6V1G2, MLANA, SGSM2, TYRP1, RAB27A, TYR",543,106,15239,2.118072205427569,1.0,0.3658889205200967,0.3076420295852831
101,GOTERM_CC_5,GO:0031234~extrinsic component of cytoplasmic side of plasma membrane,8,1.0638297872340423,0.083678632047197,"GNAL, KCNIP1, GNG4, KCNAB2, RGS11, RGS8, GNG13, RGS7",543,106,15239,2.118072205427569,1.0,0.3658889205200967,0.3076420295852831
102,GOTERM_CC_5,GO:0030017~sarcomere,12,1.5957446808510638,0.0937438369782359,"MYL4, NEBL, MYL2, TMOD2, KCNN2, ANK3, SCN3B, ANK1, GRIN2B, TIMP4, SLC8A1, SCN1A",543,197,15239,1.7095100541268191,1.0,0.4059199154591577,0.3413003773479465
103,GOTERM_CC_5,GO:0071782~endoplasmic reticulum tubular network,3,0.3989361702127659,0.0977216155886467,"ASPH, ATL1, KPNB1",543,15,15239,5.6128913443830575,1.0,0.4150841957384423,0.3490057699594526
104,GOTERM_CC_5,GO:0033270~paranode region of axon,3,0.3989361702127659,0.0977216155886467,"SPTBN4, ANK3, ERMN",543,15,15239,5.6128913443830575,1.0,0.4150841957384423,0.3490057699594526
