,Category,Term,Count,%,PValue,Genes,List Total,Pop Hits,Pop Total,Fold Enrichment,Bonferroni,Benjamini,FDR
0,GOTERM_CC_5,GO:0030424~axon,98,13.031914893617024,8.98336812718915e-40,"ITSN1, STMN3, CRHBP, ATCAY, TUBB3, KIF5B, PALM, KIF5A, KIF21A, BSN, SCN1A, UNC13C, EPHA4, PDGFRA, DSCAM, ANK3, PDYN, ANK1, GABRG2, ERMN, MAPK8IP1, OLFM1, ADCYAP1, PCP4, RUFY3, KCNQ2, PGR, PVALB, SPTBN4, GRIA2, HPCA, CACNA1B, CPLX1, MBP, SCN3A, GRIA3, GRIA4, SYT4, PTPRN2, SYT1, BDNF, GRIN2B, SYT7, DLG2, NMU, GABRB3, CNTNAP2, KCNC1, KCNC2, KCNC4, GRIK1, SLC6A1, GRM1, CALB2, SHH, SEPT6, CALB1, PCLO, LRRTM1, NCS1, NEFL, NEFM, KIF1B, KIF1A, NEFH, MYOC, SLC32A1, DCC, KCNAB2, ADRA2C, SYN2, SYN1, DNM3, GAP43, KCNMA1, VAMP1, MAPT, RAPGEF3, RAPGEF4, DDC, STAU2, ATL1, NRXN1, KCNA2, PTPRZ1, SPOCK1, SLC17A6, NCAM2, CTNNA2, SNCA, GABRA2, NTRK2, GAD1, GAD2, CCK, TUBB4A, APC, CDK5R1",543,570,15239,4.825117120609997,4.0065821847263606e-37,4.0065821847263606e-37,3.368763047695931e-37
1,GOTERM_CC_5,GO:0043025~neuronal cell body,93,12.367021276595745,9.456354022195816e-32,"PCSK2, NRSN2, NRSN1, KCNC1, KCNC2, KCNC4, RASGRF1, ELAVL4, KNDC1, GRIK1, PTPRF, GRM1, GRIP1, CRHBP, SHH, CALB1, PCLO, TUBB3, KIF5A, RESP18, NEFM, KIF1A, BSN, RGS8, NEFH, SCN1A, EPHA4, RBFOX3, KCND2, SEZ6L, PDYN, MAPK8IP2, ERMN, GIP, PCP2, OLFM1, RUFY3, KCNMA1, PGR, ARHGEF7, PVALB, RAPGEF3, RAPGEF4, SPTBN4, GRIA2, DDC, CHRNA3, PDE1C, KLHL14, CHRNA4, STAU2, NRXN1, HPCA, KCNA2, SEZ6, CACNA1B, CRMP1, SLC1A3, CACNA1A, ASCL1, SEZ6L2, CACNA1E, CPLX1, GLRA1, GLRA3, PTPRZ1, MBP, KCNN2, ASIC2, SCN3A, GRIA3, GRIA4, GABRA2, NTRK2, SYT4, SKOR1, KCNIP1, BDNF, KCNIP4, KLHL1, CCK, ATP2B2, TUBB4A, SYT7, MAPK10, TTLL7, NELL2, GRIN3A, DLG2, DAB1, APC, VIP, CDK5R1",543,639,15239,4.084498396147295,4.2175338938993335e-29,2.1087669469496668e-29,1.7730663791617156e-29
2,GOTERM_CC_5,GO:0097060~synaptic membrane,64,8.51063829787234,5.0684932257553335e-31,"GABRB3, GABRB2, CLSTN2, KCNC2, FAIM2, GRIK1, GRM1, GRIP1, RIMS1, GABRR1, NETO1, LRRTM3, LRRTM4, LRRTM1, PALM, NCS1, SH2D5, ANKS1B, CHRNB2, UNC13C, EPHA4, CHRNB3, KCND2, ANK3, SHISA9, ANK1, GABRG2, GABRG1, SEPT3, KCTD8, STX1B, OLFM1, KCNMA1, GRIA2, CHRNA3, CHRNA4, NRXN1, CHRNA6, KCNA2, NRXN3, LIN7A, GLRA1, GLRA2, GLRA3, PTPRZ1, SRGAP2, GABRD, GRIA3, CACNG5, GRIA4, GABRA2, NTRK2, GABRA1, SYT1, GABRA4, IQSEC3, PCDH8, GAD2, GRIN2B, SYT7, GRIN3A, DLG2, CNIH3, CBLN1",543,302,15239,5.94743453709463,2.260547978686878e-28,7.53515992895626e-29,6.335616532194166e-29
3,GOTERM_CC_5,GO:0034702~ion channel complex,60,7.978723404255319,1.606626711983174e-30,"GABRB3, GABRB2, CNTNAP2, KCNC1, KCNC2, KCNC4, GRIK1, GABRR1, KCNT1, LRRTM4, SCN1A, CHRNB2, CHRNB3, KCND2, CACNA2D3, KCNAB2, SHISA9, GABRG2, SHISA6, GABRG1, OLFM1, OLFM3, KCNMA1, KCNQ2, SCN4B, GRIA2, CHRNA3, NRN1, CHRNA4, CHRNA6, KCNA2, CACNA1B, CACNA1A, AKAP6, CACNA1E, GLRA1, GLRA2, GLRA3, KCNMB4, CACNG2, SCN3B, SCN3A, GABRD, CACNG3, CACNG4, GRIA3, CACNG5, GRIA4, GABRA2, GABRA1, KCNIP1, GABRA4, KCNIP4, GRIN2B, GRIN3A, DLG2, KCNS2, VWC2, CNIH3, MCU",543,267,15239,6.306619488070851,7.1655551354449555e-28,1.7913887838612389e-28,1.5062125424842258e-28
4,GOTERM_CC_5,GO:1902495~transmembrane transporter complex,62,8.24468085106383,6.464946261834906e-30,"GABRB3, GABRB2, CNTNAP2, KCNC1, KCNC2, KCNC4, GRIK1, GABRR1, KCNT1, LRRTM4, SCN1A, CHRNB2, CHRNB3, KCND2, CACNA2D3, KCNAB2, ATP1B1, SHISA9, GABRG2, SHISA6, GABRG1, OLFM1, OLFM3, KCNMA1, KCNQ2, SCN4B, GRIA2, CHRNA3, NRN1, CHRNA4, CHRNA6, KCNA2, CACNA1B, CACNA1A, AKAP6, CACNA1E, GLRA1, GLRA2, GLRA3, KCNMB4, CACNG2, SCN3B, SCN3A, GABRD, CACNG3, CACNG4, GRIA3, CACNG5, GRIA4, GABRA2, GABRA1, KCNIP1, GABRA4, KCNIP4, GRIN2B, GRIN3A, DLG2, KCNS2, FXYD2, VWC2, CNIH3, MCU",543,294,15239,5.9183548189073045,2.883366032778368e-27,5.766732065556735e-28,4.848709696376179e-28
5,GOTERM_CC_5,GO:0033267~axon part,63,8.377659574468085,1.0602804809208749e-29,"GABRB3, CNTNAP2, KCNC1, KCNC2, KCNC4, ITSN1, GRIK1, CALB2, CRHBP, SEPT6, CALB1, PCLO, KIF5B, NEFL, KIF1B, SCN1A, UNC13C, EPHA4, MYOC, SLC32A1, ANK3, KCNAB2, ADRA2C, PDYN, ANK1, SYN2, ERMN, SYN1, MAPK8IP1, OLFM1, ADCYAP1, KCNMA1, KCNQ2, VAMP1, PGR, MAPT, PVALB, RAPGEF3, RAPGEF4, SPTBN4, GRIA2, NRXN1, KCNA2, CACNA1B, CPLX1, SPOCK1, SLC17A6, MBP, GRIA3, SNCA, GRIA4, NTRK2, PTPRN2, SYT1, BDNF, GAD1, CCK, TUBB4A, GRIN2B, SYT7, DLG2, APC, NMU",543,307,15239,5.759155613943527,4.728850944907102e-27,7.881418241511835e-28,6.626753005755467e-28
6,GOTERM_CC_5,GO:0030425~dendrite,89,11.835106382978724,5.264039247398824e-29,"PCSK2, KCNC1, KCNC2, KCNC4, RASGRF1, ICA1, ELAVL4, KNDC1, GRIK1, SLC8A1, GRM1, LAMP5, JPH4, TRIM9, GRIP1, CRHBP, GRM5, SHH, CALB1, ATCAY, PCLO, TUBB3, PALM, NCS1, KIF21A, BSN, RGS8, RGS7, ANKS1B, EPHA4, SLC32A1, KCND2, FBXO2, ANK3, PDYN, SYN1, MAPK8IP1, DNM3, RUFY3, KCNMA1, DCX, PGR, MAPT, RAPGEF4, GRIA2, CHRNA3, CHRNA4, STAU2, HPCA, KCNA2, SEZ6, CACNA1B, CRMP1, SLC1A3, CACNA1A, ADCY2, CPLX1, GLRA1, GLRA3, PTPRZ1, KCNN2, ASIC2, SRGAP2, GRIA3, GRIA4, GABRA2, NTRK2, SYT4, SKOR1, KCNIP1, BDNF, HTR1D, KCNIP4, PCDH8, KLHL1, RAB27A, CCK, ATP2B2, GRIN2B, SYT7, GNG13, TTLL7, NELL2, DLG2, APC, APBA1, RGS11, CNIH3, CDK5R1",543,637,15239,3.921093639325683,2.3477615043398754e-26,3.3539450061998216e-27,2.8200210253922267e-27
7,GOTERM_CC_5,GO:0045211~postsynaptic membrane,51,6.781914893617021,3.3758373801846e-26,"GABRB3, GABRB2, CLSTN2, KCNC2, FAIM2, GRIK1, GRM1, GRIP1, GABRR1, NETO1, LRRTM3, LRRTM4, LRRTM1, NCS1, SH2D5, ANKS1B, CHRNB2, EPHA4, CHRNB3, KCND2, ANK3, ANK1, GABRG2, GABRG1, KCTD8, KCNMA1, GRIA2, CHRNA3, CHRNA4, CHRNA6, LIN7A, GLRA1, GLRA2, GLRA3, PTPRZ1, SRGAP2, GABRD, GRIA3, CACNG5, GRIA4, GABRA2, NTRK2, GABRA1, GABRA4, IQSEC3, PCDH8, GRIN2B, GRIN3A, DLG2, CNIH3, CBLN1",543,224,15239,6.389675414364641,1.5056234715623317e-23,1.8820293394529142e-24,1.5824237719615311e-24
8,GOTERM_CC_5,GO:0044306~neuron projection terminus,45,5.98404255319149,1.0184658619348308e-22,"GABRB3, GRIA2, KCNC2, KCNC4, KCNA2, ITSN1, CACNA1B, GRIK1, CPLX1, CALB2, CRHBP, SEPT6, CALB1, PCLO, BSN, GRIA3, SNCA, GRIA4, UNC13C, EPHA4, NTRK2, SYT4, PTPRN2, SLC32A1, SYT1, BDNF, GAD1, CCK, KCNAB2, ADRA2C, PDYN, GRIN2B, SYN2, SYN1, SYT7, ADCYAP1, APC, KCNMA1, NMU, VAMP1, PGR, SCRG1, PVALB, RAPGEF3, RAPGEF4",543,202,15239,6.25198293309994,4.5423577442293464e-20,5.047064160254829e-21,4.243607758061795e-21
9,GOTERM_CC_5,GO:0014069~postsynaptic density,46,6.117021276595745,1.6471609505134737e-20,"GRIA2, CHRNA3, CLSTN2, GRIK1, LIN7A, CABP1, GRM1, ADD2, RIMS1, GRM5, PCLO, NETO1, NCS1, PALM, NEFM, MAP4, CTNNA2, BSN, SRGAP2, NEFH, SH2D5, GRIA3, GRIA4, ANKS1B, CACNG5, CAP2, EPHA4, NTRK2, DMTN, KCND2, BCL11A, NETO2, KCNAB2, SYN3, MAPK8IP2, GRIN2B, SYN2, SYN1, DCLK1, DNM3, MAPK10, GAP43, DAB1, DLG2, MAPT, CDK5R1",543,239,15239,5.401527235180348,7.346337839290092e-18,6.678488944809175e-19,5.615321422205026e-19
10,GOTERM_CC_5,GO:0099572~postsynaptic specialization,46,6.117021276595745,1.6471609505134737e-20,"GRIA2, CHRNA3, CLSTN2, GRIK1, LIN7A, CABP1, GRM1, ADD2, RIMS1, GRM5, PCLO, NETO1, NCS1, PALM, NEFM, MAP4, CTNNA2, BSN, SRGAP2, NEFH, SH2D5, GRIA3, GRIA4, ANKS1B, CACNG5, CAP2, EPHA4, NTRK2, DMTN, KCND2, BCL11A, NETO2, KCNAB2, SYN3, MAPK8IP2, GRIN2B, SYN2, SYN1, DCLK1, DNM3, MAPK10, GAP43, DAB1, DLG2, MAPT, CDK5R1",543,239,15239,5.401527235180348,7.346337839290092e-18,6.678488944809175e-19,5.615321422205026e-19
11,GOTERM_CC_5,GO:0043679~axon terminus,41,5.452127659574469,2.318200005216192e-20,"GABRB3, GRIA2, KCNC2, KCNC4, KCNA2, ITSN1, CACNA1B, GRIK1, CPLX1, CALB2, CRHBP, SEPT6, CALB1, PCLO, GRIA3, SNCA, GRIA4, UNC13C, EPHA4, NTRK2, PTPRN2, SLC32A1, SYT1, BDNF, GAD1, CCK, KCNAB2, ADRA2C, PDYN, GRIN2B, SYN2, SYN1, SYT7, ADCYAP1, KCNMA1, NMU, VAMP1, PGR, PVALB, RAPGEF3, RAPGEF4",543,188,15239,6.120440029779398,1.0339172023264216e-17,8.382265208620469e-19,7.047868729221247e-19
12,GOTERM_CC_5,GO:0044459~plasma membrane part,177,23.537234042553195,2.4432611594633656e-20,"CLSTN2, AMHR2, HHIP, WWC1, RRH, AQP4, FAIM2, SLC8A1, SLC4A5, LAMP5, GRIP1, RIMS1, CDH4, PALM, ENPP2, SLC16A8, CAR9, RGS8, BVES, SH2D5, SCN1A, PRIMA1, RGS7, ANKS1B, CHRNB2, UNC13C, EPHA4, PDGFRA, CHRNB3, DSCAM, EPHA8, CACNA2D3, ANK3, SHISA9, ATP1B1, TMEM130, ANK1, LOR, GABRG2, SHISA6, GABRG1, KCTD8, OLFM1, STX1B, FOLH1, OLFM3, SLC5A9, KCNQ2, PRKCQ, ATF4, GRIA2, NDRG4, CHRNA3, NRN1, PCDH10, CHRNA4, HPCA, CHRNA6, CACNA1B, SLC1A3, CACNA1A, LIN7A, RASGRP2, CACNA1E, SNTG1, KCNMB4, KCNN2, SCN3B, ASIC2, SRGAP2, SCN3A, ASIC3, GRIA3, GRIA4, CADM3, SYT1, IQSEC3, HTR1D, RAB27A, GRIN2B, SYT7, GNG13, GRIN3A, DLG2, GNAL, FXYD2, GPR101, CNIH3, GABRB3, GABRB2, IGHM, TENM1, CNTNAP2, KCNC1, TENM4, KCNC2, GPR22, KCNC4, RASGRF1, SLC7A14, GRIK1, SLC6A1, GRM1, TSPAN10, GRM5, GABRR1, KCNT1, NETO1, LRRTM3, LRRTM4, LRRTM1, NCS1, PRKG2, APC2, IGH-VJ558, SLC32A1, KCND2, DCC, KCNAB2, ADRA2C, SEPT3, GAP43, MMP15, KCNMA1, SLC29A4, SCN4B, RAPGEF3, IGHG, RAPGEF4, SLC24A2, NRXN1, KCNA2, NRXN3, OPRL1, AKAP6, ADCY2, GLRA1, PROKR2, GLRA2, GLRA3, PTPRZ1, GNG4, MAL2, CTNNA2, CACNG2, GABRD, CACNG3, CACNG4, KCNJ3, CACNG5, CLASP2, GABRA2, NTRK2, GABRA1, KCNJ5, DMTN, KCNIP1, KCNJ9, NTRK3, GABRA4, PCDH7, PCDH8, KCNIP4, LHFPL5, GAD2, ATP2B3, ATP2B2, GPR50, SYT13, DLK1, GPR143, APC, KCNS2, VWC2, RGS11, LGR5, CBLN1",543,2548,15239,1.949532511687208,1.0896944771206609e-17,8.382265208620469e-19,7.047868729221247e-19
13,GOTERM_CC_5,GO:0098590~plasma membrane region,98,13.031914893617024,5.52413278979029e-20,"CLSTN2, WWC1, AQP4, FAIM2, SLC8A1, LAMP5, GRIP1, RIMS1, PALM, SLC16A8, CAR9, BVES, SH2D5, ANKS1B, CHRNB2, UNC13C, EPHA4, CHRNB3, ANK3, SHISA9, ATP1B1, ANK1, GABRG2, GABRG1, KCTD8, OLFM1, STX1B, ATF4, GRIA2, NDRG4, CHRNA3, CHRNA4, HPCA, CHRNA6, SLC1A3, LIN7A, RASGRP2, SNTG1, SRGAP2, GRIA3, GRIA4, SYT1, IQSEC3, RAB27A, GRIN2B, SYT7, GRIN3A, DLG2, FXYD2, CNIH3, GABRB3, GABRB2, CNTNAP2, KCNC1, KCNC2, RASGRF1, GRIK1, GRM1, GABRR1, NETO1, LRRTM3, LRRTM4, LRRTM1, NCS1, PRKG2, APC2, KCND2, SEPT3, GAP43, KCNMA1, SLC29A4, RAPGEF3, RAPGEF4, NRXN1, KCNA2, NRXN3, AKAP6, GLRA1, GLRA2, GLRA3, PTPRZ1, MAL2, CTNNA2, GABRD, CACNG5, CLASP2, GABRA2, NTRK2, GABRA1, DMTN, GABRA4, PCDH8, LHFPL5, GAD2, ATP2B2, GPR143, APC, CBLN1",543,1009,15239,2.725784696479384,2.4637632242464693e-17,1.759830874461764e-18,1.479678425836685e-18
14,GOTERM_CC_5,GO:0098797~plasma membrane protein complex,58,7.712765957446808,9.772576464942166e-16,"IGHM, CNTNAP2, KCNC1, KCNC2, KCNC4, GRIK1, GRM1, KCNT1, LRRTM4, SCN1A, RGS7, CHRNB2, APC2, CHRNB3, KCND2, CACNA2D3, KCNAB2, ATP1B1, SHISA9, SHISA6, OLFM1, OLFM3, KCNMA1, KCNQ2, SCN4B, GRIA2, CHRNA3, NRN1, CHRNA4, CHRNA6, KCNA2, CACNA1B, CACNA1A, CACNA1E, GLRA3, GNG4, KCNMB4, CACNG2, SCN3B, SCN3A, CACNG3, CACNG4, GRIA3, CACNG5, GRIA4, KCNIP1, KCNIP4, GRIN2B, GNG13, GRIN3A, DLG2, GNAL, APC, KCNS2, FXYD2, VWC2, RGS11, CNIH3",543,482,15239,3.377050808861176,4.456435220845378e-13,2.905712735576137e-14,2.443144116235541e-14
15,GOTERM_CC_5,GO:0043195~terminal bouton,28,3.723404255319149,3.1060963292517145e-15,"GABRB3, GRIA2, KCNC2, ITSN1, GRIK1, CPLX1, CALB2, CALB1, PCLO, GRIA3, SNCA, GRIA4, UNC13C, NTRK2, PTPRN2, SYT1, BDNF, CCK, GRIN2B, SYN2, SYN1, SYT7, ADCYAP1, KCNMA1, NMU, VAMP1, PVALB, RAPGEF3",543,115,15239,6.833085114901113,1.3864465131518957e-12,8.658243517789156e-14,7.279913271683705e-14
16,GOTERM_CC_5,GO:0008328~ionotropic glutamate receptor complex,19,2.5265957446808507,3.9347392465698785e-14,"GRIA2, NRN1, GRIK1, SHISA9, GRIN2B, SHISA6, OLFM1, GRIN3A, DLG2, OLFM3, LRRTM4, VWC2, CACNG2, CACNG3, CNIH3, CACNG4, GRIA3, CACNG5, GRIA4",543,50,15239,10.664493554327809,1.7528645201991818e-11,1.0322904141000974e-12,8.679571867433555e-13
17,GOTERM_CC_5,GO:0032281~AMPA glutamate receptor complex,15,1.9946808510638296,3.782769889281235e-13,"GRIA2, NRN1, SHISA9, SHISA6, OLFM1, OLFM3, LRRTM4, VWC2, CACNG2, CACNG3, CNIH3, CACNG4, GRIA3, CACNG5, GRIA4",543,30,15239,14.032228360957642,1.6870083108244669e-10,9.372863170107947e-12,7.88077060266924e-12
18,GOTERM_CC_5,GO:0005887~integral component of plasma membrane,100,13.297872340425531,1.247320376696034e-12,"AMHR2, HHIP, RRH, AQP4, SLC8A1, SLC4A5, CDH4, ENPP2, SLC16A8, SCN1A, CHRNB2, EPHA4, PDGFRA, CHRNB3, DSCAM, EPHA8, SHISA9, ATP1B1, TMEM130, GABRG2, SHISA6, OLFM1, FOLH1, OLFM3, SLC5A9, KCNQ2, GRIA2, CHRNA3, NRN1, PCDH10, CHRNA4, CHRNA6, KCNMB4, SCN3B, ASIC2, SCN3A, ASIC3, GRIA3, GRIA4, CADM3, HTR1D, GRIN2B, GRIN3A, DLG2, FXYD2, GPR101, CNIH3, GABRB3, GABRB2, TENM1, CNTNAP2, KCNC1, TENM4, KCNC2, GPR22, KCNC4, SLC7A14, GRIK1, SLC6A1, GRM1, TSPAN10, GRM5, KCNT1, LRRTM4, SLC32A1, KCND2, KCNAB2, ADRA2C, MMP15, KCNMA1, SCN4B, SLC24A2, KCNA2, OPRL1, ADCY2, GLRA1, PROKR2, GLRA2, GLRA3, CACNG2, CACNG3, CACNG4, KCNJ3, CACNG5, NTRK2, GABRA1, KCNJ5, KCNIP1, KCNJ9, NTRK3, PCDH7, PCDH8, KCNIP4, ATP2B3, ATP2B2, GPR50, SYT13, KCNS2, VWC2, LGR5",543,1342,15239,2.0912411864318394,5.563116634021981e-10,2.9279204631917424e-11,2.4618165329526983e-11
19,GOTERM_CC_5,GO:0008021~synaptic vesicle,29,3.856382978723404,1.4441642374004897e-12,"GRIA2, RAB3C, DDC, KCNC4, ICA1, TMEM163, RPH3A, TRIM9, SEPT6, SLC17A6, SNCA, GABRA2, UNC13C, SYT4, PTPRN2, ATP6V1G2, SLC32A1, SYT1, BDNF, GAD2, SYN3, GRIN2B, SYN2, SYN1, SYT7, STX1B, VAMP1, APBA1, APBA2",543,157,15239,5.183880540990722,6.44103437252852e-10,3.220486249403092e-11,2.707807945125918e-11
20,GOTERM_CC_5,GO:0070382~exocytic vesicle,30,3.98936170212766,2.486965160251533e-12,"GRIA2, RAB3C, DDC, KCNC4, ICA1, TMEM163, RPH3A, TRIM9, SEPT6, SLC17A6, SNCA, GABRA2, UNC13C, SYT4, PTPRN2, ATP6V1G2, SLC32A1, SYT1, BDNF, GAD2, RAB27A, SYN3, GRIN2B, SYN2, SYN1, SYT7, STX1B, VAMP1, APBA1, APBA2",543,172,15239,4.8949633817294105,1.1092067264684147e-09,5.2818402927246835e-11,4.441009214734881e-11
21,GOTERM_CC_5,GO:0030426~growth cone,31,4.122340425531915,3.3732646387102028e-12,"GRIA2, NRSN1, NRXN1, RASGRF1, ELAVL4, CRMP1, STMN3, PTPRF, LAMP5, PCLO, PTPRZ1, LRRTM1, KIF5B, NEFL, SNCA, EPHA4, NTRK2, DSCAM, DCC, TMOD2, CABLES1, MAPK8IP1, OLFM1, GAP43, APC, RUFY3, MAPT, ARHGEF7, RAPGEF3, CDK5R1, RAPGEF4",543,186,15239,4.677409453652548,1.5044925305573995e-09,6.838527403930684e-11,5.749882906892392e-11
22,GOTERM_CC_5,GO:0031226~intrinsic component of plasma membrane,102,13.563829787234042,4.78947391048156e-12,"AMHR2, HHIP, RRH, AQP4, SLC8A1, SLC4A5, CDH4, ENPP2, SLC16A8, SCN1A, PRIMA1, CHRNB2, EPHA4, PDGFRA, CHRNB3, DSCAM, EPHA8, SHISA9, ATP1B1, TMEM130, GABRG2, SHISA6, OLFM1, FOLH1, OLFM3, SLC5A9, KCNQ2, GRIA2, CHRNA3, NRN1, PCDH10, CHRNA4, CHRNA6, KCNMB4, SCN3B, ASIC2, SCN3A, ASIC3, GRIA3, GRIA4, CADM3, HTR1D, GRIN2B, GRIN3A, DLG2, FXYD2, GPR101, CNIH3, GABRB3, GABRB2, TENM1, CNTNAP2, KCNC1, TENM4, KCNC2, GPR22, KCNC4, SLC7A14, GRIK1, SLC6A1, GRM1, TSPAN10, GRM5, KCNT1, LRRTM4, SLC32A1, KCND2, KCNAB2, ADRA2C, MMP15, KCNMA1, SCN4B, SLC24A2, KCNA2, OPRL1, ADCY2, GLRA1, PROKR2, GLRA2, GLRA3, PTPRZ1, CACNG2, CACNG3, CACNG4, KCNJ3, CACNG5, NTRK2, GABRA1, KCNJ5, KCNIP1, KCNJ9, NTRK3, PCDH7, PCDH8, KCNIP4, ATP2B3, ATP2B2, GPR50, SYT13, KCNS2, VWC2, LGR5",543,1413,15239,2.025884349352696,2.1361179491918847e-09,9.287414626412067e-11,7.808924854046022e-11
23,GOTERM_CC_5,GO:0030133~transport vesicle,40,5.319148936170213,7.57691582014879e-12,"PCSK2, GRIA2, RAB3C, PCSK1, DDC, NRSN2, NRSN1, KCNC4, ICA1, TMEM163, RPH3A, TRIM9, SHH, SEPT6, PCLO, SLC17A6, NPTX1, SNCA, CHGA, GABRA2, UNC13C, SYT4, PTPRN2, ATP6V1G2, SLC32A1, SYT1, BDNF, DDHD2, GAD2, RAB27A, SYT13, SYN3, GRIN2B, SYN2, SYN1, SYT7, STX1B, VAMP1, APBA1, APBA2",543,312,15239,3.5980072720404213,3.37931482796705e-09,1.4080435232443166e-10,1.1838930968982484e-10
24,GOTERM_CC_5,GO:0043204~perikaryon,27,3.590425531914894,1.8012311777730195e-11,"PCSK2, GRIA2, KCNC2, HPCA, KCNA2, CACNA1A, CACNA1E, CRHBP, GLRA1, GLRA3, RESP18, NEFM, RGS8, NEFH, GRIA3, EPHA4, NTRK2, RBFOX3, KCND2, BDNF, CCK, TTLL7, MAPK10, NELL2, OLFM1, RUFY3, PGR",543,150,15239,5.051602209944751,8.033467224777269e-09,3.2133964211470667e-10,2.701846766659529e-10
25,GOTERM_CC_5,GO:0034703~cation channel complex,27,3.590425531914894,5.209467115074477e-11,"CNTNAP2, KCNC1, KCNC2, KCNC4, KCNA2, CACNA1B, CACNA1A, AKAP6, CACNA1E, KCNT1, KCNMB4, CACNG2, SCN3B, SCN3A, CACNG4, SCN1A, KCNIP1, KCND2, KCNIP4, CACNA2D3, KCNAB2, DLG2, KCNS2, KCNMA1, KCNQ2, SCN4B, MCU",543,157,15239,4.826371538163775,2.3234218993195558e-08,8.936239743550831e-10,7.51365449289588e-10
26,GOTERM_CC_5,GO:0044304~main axon,19,2.5265957446808507,9.115462783013408e-11,"SPTBN4, CNTNAP2, MYOC, KCNC1, KCNC2, KCNA2, CCK, KCNAB2, ANK3, TUBB4A, ANK1, ERMN, CRHBP, DLG2, KCNQ2, SPOCK1, MBP, MAPT, SCN1A",543,75,15239,7.109662369551873,4.0654968391784514e-08,1.5057394078607334e-09,1.266036497640751e-09
27,GOTERM_CC_5,GO:0098802~plasma membrane receptor complex,26,3.4574468085106385,7.540171214182266e-10,"GRIA2, IGHM, CHRNA3, NRN1, CHRNA4, CHRNA6, GRIK1, GRM1, LRRTM4, CACNG2, CACNG3, CACNG4, GRIA3, GRIA4, CACNG5, CHRNB2, CHRNB3, SHISA9, GRIN2B, SHISA6, OLFM1, GRIN3A, DLG2, OLFM3, VWC2, CNIH3",543,164,15239,4.449243138840228,3.362915572679981e-07,1.2010415576876042e-08,1.009844359042268e-08
28,GOTERM_CC_5,GO:0030672~synaptic vesicle membrane,17,2.2606382978723407,1.10304577694366e-09,"GABRA2, UNC13C, GRIA2, SYT4, PTPRN2, ATP6V1G2, SYT1, ICA1, GAD2, SYN3, TMEM163, SYN2, SYN1, SYT7, RPH3A, VAMP1, SLC17A6",543,67,15239,7.12083230257552,4.919582907714215e-07,1.6398613883895748e-08,1.3788072211795752e-08
29,GOTERM_CC_5,GO:0099501~exocytic vesicle membrane,17,2.2606382978723407,1.10304577694366e-09,"GABRA2, UNC13C, GRIA2, SYT4, PTPRN2, ATP6V1G2, SYT1, ICA1, GAD2, SYN3, TMEM163, SYN2, SYN1, SYT7, RPH3A, VAMP1, SLC17A6",543,67,15239,7.12083230257552,4.919582907714215e-07,1.6398613883895748e-08,1.3788072211795752e-08
30,GOTERM_CC_5,GO:0042734~presynaptic membrane,18,2.393617021276596,1.523956528892327e-09,"UNC13C, GRIA2, SYT1, KCNC2, NRXN1, PCDH8, KCNA2, NRXN3, GAD2, GRIK1, GRIN2B, GRM1, SYT7, SEPT3, KCTD8, RIMS1, STX1B, KCNMA1",543,78,15239,6.476413089672757,6.796843758927196e-07,2.1925310060838e-08,1.8434958010794286e-08
31,GOTERM_CC_5,GO:0043197~dendritic spine,24,3.191489361702128,5.4295869561845535e-09,"NTRK2, EPHA4, GRIA2, KCND2, FBXO2, HPCA, SEZ6, SLC1A3, GRIN2B, GRM1, SLC8A1, DNM3, GRM5, PTPRZ1, PALM, PGR, KCNN2, APBA1, ASIC2, SRGAP2, GRIA3, CDK5R1, ANKS1B, RAPGEF4",543,154,15239,4.373681567051732,2.4215928775550566e-06,7.56748682018222e-08,6.362797214278773e-08
32,GOTERM_CC_5,GO:0044309~neuron spine,24,3.191489361702128,6.997816802598286e-09,"NTRK2, EPHA4, GRIA2, KCND2, FBXO2, HPCA, SEZ6, SLC1A3, GRIN2B, GRM1, SLC8A1, DNM3, GRM5, PTPRZ1, PALM, PGR, KCNN2, APBA1, ASIC2, SRGAP2, GRIA3, CDK5R1, ANKS1B, RAPGEF4",543,156,15239,4.317608726448505,3.1210214201937703e-06,9.457655436238896e-08,7.952064548407145e-08
33,GOTERM_CC_5,GO:0048786~presynaptic active zone,12,1.5957446808510638,1.4169179117866848e-08,"RIMS2, UNC13C, RIMS1, NTRK2, RIMS3, PCLO, SLC32A1, GAD1, KCNMA1, BSN, PPFIA3, SYN1",543,34,15239,9.905102372440687,6.31943398388124e-06,1.858662907814298e-07,1.5627771085882552e-07
34,GOTERM_CC_5,GO:1902711~GABA-A receptor complex,9,1.196808510638298,7.769227758672067e-08,"GABRB3, GABRA2, GABRB2, GABRA1, GABRR1, GABRA4, GABRD, GABRG2, GABRG1",543,18,15239,14.032228360957642,3.46501568301294e-05,9.900215943907831e-07,8.324172598577212e-07
35,GOTERM_CC_5,GO:0008076~voltage-gated potassium channel complex,16,2.127659574468085,1.417358072031576e-07,"CNTNAP2, KCNIP1, KCNC1, KCND2, KCNC2, KCNA2, KCNIP4, KCNC4, KCNAB2, DLG2, KCNT1, KCNS2, KCNMA1, KCNQ2, KCNMB4, SCN3A",543,81,15239,5.543596389514131,6.321217651816813e-05,1.755949167016897e-06,1.476414658366225e-06
36,GOTERM_CC_5,"GO:0016023~cytoplasmic, membrane-bounded vesicle",72,9.574468085106384,4.099508759658015e-07,"PCSK2, PNLIPRP2, RAB3C, PCSK1, NRSN2, NRSN1, KCNC4, ITSN1, ICA1, LAMP5, RPH3A, TRIM9, GRIP1, CRHBP, SHH, SEPT6, PCLO, CAMKV, KIF5B, NCS1, RESP18, KIF1B, PPFIA3, UNC13C, ATP6V1G2, MYOC, SLC32A1, APOA1, SYN3, SYN2, SYN1, GIP, F5, STX1B, VAMP1, GRIA2, OCA2, DDC, NRXN1, ABHD2, TYRP1, OPRL1, TMEM163, ADD2, MLANA, CLVS2, SLC17A6, NPTX1, SRGAP2, RAB6B, RAB11FIP4, SNCA, GABRA2, CHGA, SYT4, DMTN, PTPRN2, SYT1, BDNF, DDHD2, GAD2, RAB27A, SYT13, TYR, GRIN2B, SYT7, GPR143, NSG2, SGSM2, APBA1, APBA2, RAB9B",543,1087,15239,1.8589152566494025,0.00018282141426240184,4.94157001839858e-06,4.154907526680421e-06
37,GOTERM_CC_5,GO:0034707~chloride channel complex,12,1.5957446808510638,4.483540523526441e-07,"GABRB3, GABRA2, GABRB2, GABRA1, GLRA1, GABRR1, GLRA2, GLRA3, GABRA4, GABRD, GABRG2, GABRG1",543,46,15239,7.321162623108335,0.0001999459603081455,5.262260719717875e-06,4.424546569269514e-06
38,GOTERM_CC_5,GO:0099503~secretory vesicle,41,5.452127659574469,7.68630058246924e-07,"PCSK2, PNLIPRP2, GRIA2, RAB3C, PCSK1, DDC, ABHD2, KCNC4, ICA1, TMEM163, RPH3A, TRIM9, CRHBP, SEPT6, NCS1, RESP18, SLC17A6, PPFIA3, SNCA, CHGA, GABRA2, UNC13C, SYT4, PTPRN2, ATP6V1G2, SLC32A1, SYT1, BDNF, GAD2, RAB27A, SYN3, GRIN2B, SYN2, SYN1, SYT7, GIP, F5, STX1B, VAMP1, APBA1, APBA2",543,487,15239,2.3627160689908147,0.00034275038539544056,8.789974512259695e-06,7.390673636989654e-06
39,GOTERM_CC_5,GO:0030658~transport vesicle membrane,18,2.393617021276596,1.8425909900964051e-06,"CHGA, GABRA2, UNC13C, GRIA2, SYT4, PTPRN2, ATP6V1G2, SYT1, ICA1, GAD2, SYN3, TMEM163, SYN2, SYN1, SYT7, RPH3A, VAMP1, SLC17A6",543,124,15239,4.073872749955444,0.0008214587565806841,2.054488953957492e-05,1.72742905321538e-05
40,GOTERM_CC_5,GO:0031256~leading edge membrane,19,2.5265957446808507,4.80222387517026e-06,"GABRA2, APC2, CNTNAP2, KCNC1, KCNC2, WWC1, KCNA2, HPCA, RASGRP2, SHISA9, ANK1, GABRG2, LAMP5, APC, PTPRZ1, SNTG1, PALM, ATF4, CLASP2",543,147,15239,3.627378759975445,0.0021395049805045,5.223882556892527e-05,4.3922779346069454e-05
41,GOTERM_CC_5,GO:0044433~cytoplasmic vesicle part,35,4.654255319148936,7.250831989767755e-06,"PNLIPRP2, GRIA2, PCSK1, OCA2, ABHD2, TYRP1, ICA1, TMEM163, LAMP5, RPH3A, CAMKV, SLC17A6, KIF1B, SNCA, CHGA, GABRA2, UNC13C, SYT4, PTPRN2, ATP6V1G2, SLC32A1, SYT1, GAD2, RAB27A, SYT13, SYN3, TYR, SYN2, SYN1, SYT7, GIP, GPR143, NSG2, VAMP1, RAB9B",543,420,15239,2.3387047268262737,0.0032286594247443,7.699693017705759e-05,6.47395713372121e-05
42,GOTERM_CC_5,GO:0031410~cytoplasmic vesicle,73,9.707446808510635,8.446286592002781e-06,"PCSK2, PNLIPRP2, RAB3C, PCSK1, NRSN2, NRSN1, KCNC4, ITSN1, ICA1, LAMP5, RPH3A, TRIM9, GRIP1, CRHBP, SHH, SEPT6, PCLO, CAMKV, KIF5B, NCS1, RESP18, KIF1B, ERMAP, PPFIA3, UNC13C, ATP6V1G2, MYOC, SLC32A1, APOA1, SYN3, SYN2, SYN1, GIP, F5, STX1B, VAMP1, GRIA2, OCA2, DDC, NRXN1, ABHD2, TYRP1, OPRL1, TMEM163, ADD2, MLANA, CLVS2, SLC17A6, NPTX1, SRGAP2, RAB6B, RAB11FIP4, SNCA, GABRA2, CHGA, SYT4, DMTN, PTPRN2, SYT1, BDNF, DDHD2, GAD2, RAB27A, SYT13, TYR, GRIN2B, SYT7, GPR143, NSG2, SGSM2, APBA1, APBA2, RAB9B",543,1205,15239,1.700170407219764,0.003759973260573,8.760567023333118e-05,7.365947609304751e-05
43,GOTERM_CC_5,GO:0097708~intracellular vesicle,73,9.707446808510635,9.140339380023217e-06,"PCSK2, PNLIPRP2, RAB3C, PCSK1, NRSN2, NRSN1, KCNC4, ITSN1, ICA1, LAMP5, RPH3A, TRIM9, GRIP1, CRHBP, SHH, SEPT6, PCLO, CAMKV, KIF5B, NCS1, RESP18, KIF1B, ERMAP, PPFIA3, UNC13C, ATP6V1G2, MYOC, SLC32A1, APOA1, SYN3, SYN2, SYN1, GIP, F5, STX1B, VAMP1, GRIA2, OCA2, DDC, NRXN1, ABHD2, TYRP1, OPRL1, TMEM163, ADD2, MLANA, CLVS2, SLC17A6, NPTX1, SRGAP2, RAB6B, RAB11FIP4, SNCA, GABRA2, CHGA, SYT4, DMTN, PTPRN2, SYT1, BDNF, DDHD2, GAD2, RAB27A, SYT13, TYR, GRIN2B, SYT7, GPR143, NSG2, SGSM2, APBA1, APBA2, RAB9B",543,1209,15239,1.694545360380327,0.0040683118996653,9.264980371568988e-05,7.790061971610697e-05
44,GOTERM_CC_5,GO:0032589~neuron projection membrane,11,1.4627659574468086,1.023164447488977e-05,"LAMP5, GABRA2, CNTNAP2, KCNC1, KCNC2, PALM, HPCA, SHISA9, ANK1, GABRG2, ATF4",543,51,15239,6.053118116491532,0.004552940579573,0.0001014069652400186,8.526370395741475e-05
45,GOTERM_CC_5,GO:0030659~cytoplasmic vesicle membrane,33,4.388297872340425,1.1323767003516369e-05,"PNLIPRP2, GRIA2, OCA2, ABHD2, TYRP1, ICA1, TMEM163, LAMP5, RPH3A, CAMKV, SLC17A6, KIF1B, SNCA, CHGA, GABRA2, UNC13C, SYT4, PTPRN2, ATP6V1G2, SLC32A1, SYT1, GAD2, RAB27A, SYT13, SYN3, TYR, SYN2, SYN1, SYT7, GPR143, NSG2, VAMP1, RAB9B",543,392,15239,2.3625690607734806,0.0050376967066356,0.00010979130616452828,9.231331796344866e-05
46,GOTERM_CC_5,GO:0031253~cell projection membrane,26,3.4574468085106385,6.591702672076849e-05,"CNTNAP2, NDRG4, KCNC1, KCNC2, WWC1, HPCA, KCNA2, AQP4, RASGRP2, LAMP5, PTPRZ1, SNTG1, PALM, CAR9, BVES, CLASP2, GABRA2, APC2, DMTN, SHISA9, ANK1, GABRG2, GAP43, APC, RAPGEF3, ATF4",543,298,15239,2.448576760972475,0.0289719883980552,0.0006255105088821861,0.0005259337238359189
47,GOTERM_CC_5,GO:0032590~dendrite membrane,8,1.0638297872340423,0.00010742810929249488,"LAMP5, GABRA2, KCNC1, PALM, HPCA, SHISA9, GABRG2, ATF4",543,32,15239,7.016114180478821,0.0467856797489841,0.000998186182176098,0.0008392821038476162
48,GOTERM_CC_5,GO:0048471~perinuclear region of cytoplasm,46,6.117021276595745,0.00012028794358631444,"IGHM, TENM1, RAB3C, WWC1, SEZ6, ICA1, STMN3, AKAP6, PCLO, MOBP, KIF5B, NCS1, KIF5A, LRAT, TPPP, RAB11FIP4, DYNC1I1, SNCA, CALN1, NANOS1, CHGA, APC2, HHATL, SYT4, DMTN, OSBPL6, KCND2, BDNF, PRKCE, APLP1, GAD2, TYR, MYO16, MAPK8IP1, DNM3, NELL1, MYO1B, DAB1, APC, KCNS2, KCNMA1, APBA1, TRIM37, APBA3, RAPGEF3, CDK5R1",543,709,15239,1.8208251187702444,0.0522377977745973,0.0010948657722346,0.0009205709968340393
49,GOTERM_CC_5,GO:0005883~neurofilament,5,0.6648936170212766,0.00017290713406072455,"PCP4, NEFL, NEFM, INA, NEFH",543,9,15239,15.591364845508494,0.0742242548815361,0.0015405424043499,0.0012952991067964
50,GOTERM_CC_5,GO:0033268~node of Ranvier,6,0.7978723404255319,0.0001761606785243202,"SPTBN4, MYOC, KCNQ2, SPOCK1, ANK3, SCN1A",543,16,15239,10.52417127071823,0.0755668902823973,0.0015405424043499,0.0012952991067964
51,GOTERM_CC_5,GO:0005874~microtubule,30,3.98936170212766,0.0002899035360140865,"STAU2, JAKMIP1, SLC8A1, CRHBP, KLC2, TUBB3, KIF5C, KIF5B, TUBB1, KIF5A, KIF1B, KIF21A, MAP4, KIF1A, TPPP, DYNC1I1, CLASP2, APC2, SPAG5, MTUS2, DCLK2, KCNAB2, TUBB4A, KIF6, KIF4, DNM3, TTLL7, APC, DCX, MAPT",543,405,15239,2.078848646067799,0.1213035025179101,0.0024864803281208,0.0020906505001015
