,Category,Term,Count,%,PValue,Genes,List Total,Pop Hits,Pop Total,Fold Enrichment,Bonferroni,Benjamini,FDR
0,GOTERM_BP_5,GO:0009966~regulation of signal transduction,167,19.53216374269006,1.9107448580639052e-19,"CSF1, SERPINE1, ULK4, WWC2, LDLRAD4, FGF2, FGF4, GJA1, BAIAP2L1, SALL1, SESN3, SALL3, MYC, DHX58, PROK2, MEN1, ZBP1, RSAD2, IL1R2, HGF, IGFBP3, IGFBP2, TSC1, MID1, EREG, RUNX1, FOXP1, TIAM2, NAIP5, SMO, CCNY, DDIT3, CD109, MADD, S100A9, S100A8, INTU, IQGAP1, ZC3HAV1, RASAL2, DDX60, RASAL3, KALRN, RASGRP4, C3, SOCS3, PDCD10, GRK4, PMAIP1, WNT2, CCL21A, WWTR1, TGFB1, GADD45B, FZD6, FN1, LIF, EIF2AK2, INHBA, GDF3, NFATC4, EFNA1, BST2, CXCL10, RCAN1, CXCL11, IL6, DAB2, DNMBP, PTPRC, BMP1, BCL6, IL7, CILP, TRP53, BCL3, CAPRIN2, NOX4, NF2, GPR18, BCL2L1, FGFR1, IGHM, CXCL9, TRIM30A, SLC44A2, LRRK1, HSPB1, PTPN22, DUSP16, CHRDL1, AKAP13, TRIM6, BDKRB2, CASP1, TIMP2, DACT2, ANKRD1, PMEPA1, ITGAV, TIMP1, LMCD1, TGIF1, IL11, ARHGEF12, PLEKHG2, TNFRSF12A, ARHGEF15, MYOF, ARHGEF19, TRAF2, NME5, WNT9A, GFRA2, DNM2, GREM1, ITPKB, PLSCR1, ELF1, MMP14, CTTN, IL1B, IRF7, PELI1, CDH13, ARHGEF1, ARHGEF2, DOCK2, DBN1, CD44, BIRC3, HBEGF, NFAT5, CCL12, LRP1, AKAP5, THBS1, FGD2, FSTL3, NKD2, NEURL1A, FGD4, CCL7, RAB23, LMNA, MARVELD3, CTNNA1, GCNT2, CCL2, NCAM1, SLIT3, CDKN2B, PRRX1, BIK, STAT1, STAT3, OSM, PTPN11, CDC42BPA, TSPAN15, P2RX4, LRG1, JSRP1, LEP, F2RL1, RGS12, CRLF1",585,2468,17152,1.9839476928617927,7.268473440075096e-16,7.268473440075096e-16,6.595891250036601e-16
1,GOTERM_BP_5,GO:0016477~cell migration,98,11.461988304093568,6.684464939289216e-16,"CSF1, SERPINE1, ULK4, PLAT, LDLRAD4, CXCL13, FGF2, FGF4, GJA1, MYC, SEMA6C, CXADR, HGF, IGFBP3, TPM1, ADAM10, VASH1, FOXP1, CH25H, SMO, ADAM15, SPECC1L, PKP2, S100A9, S100A8, CALCA, IQGAP1, KALRN, EFNB2, PDCD10, CCL21A, TGFB1, VCAM1, RCC2, FN1, MSN, NFATC2, NR2F2, DCLK1, EFNA1, BST2, CXCL10, CXCL11, DAB2, PTPRC, COL5A1, TRP53, NOX4, GPR18, FGFR1, DDR1, CXCL9, DOCK8, HSPB1, PTPN22, LAMC2, LAMC1, ITGAV, TIMP1, INSL3, EDN2, CAMK1D, TNFRSF12A, IL16, GREM1, MMP14, CTTN, PEAK1, IL1B, EFHC1, CDH13, ITGA5, CD44, SDCCAG8, HBEGF, LAMA5, CCL12, LRP1, SAA3, THBS1, ACVR1C, CCL7, MARVELD3, GCNT2, HAS2, CCL2, GPC6, MBOAT7, STAT3, PTPN11, LAMB1, SORBS2, CDC42BPA, NLRP10, LEP, SAA1, F2RL1, SAA2",585,1199,17152,2.396435776252289,2.5339730314044573e-12,1.2713852314528089e-12,1.1537386485213186e-12
2,GOTERM_BP_5,GO:0048513~animal organ development,202,23.625730994152047,1.3723817510960478e-15,"ATF2, ULK4, SERPINE1, GPATCH4, LDLRAD4, GJA1, RPS6KA2, MYC, PROK2, EPHB2, HERC6, SOX5, CDK5RAP2, CXADR, RSAD2, ACTN1, NPFF, FNDC3A, EREG, RUNX1, CD109, SIK3, INTU, IQGAP1, PPL, KALRN, NLN, CCL21A, WWTR1, CDSN, FZD2, FZD6, FN1, LIF, EIF2AK2, PRG4, NR2F2, GDF3, DCLK1, NFATC4, FOSL1, MYLPF, CYP26A1, COL1A2, NOX4, HOXD9, GPR18, DDR1, IGHM, CSRNP1, CDKN1A, SPEF2, NKAP, STON2, TFCP2L1, CHRDL1, AKAP13, SH3PXD2B, ANKRD1, CTLA4, TIMP1, EDN2, WNT9B, WNT9A, NME5, MLF1, ITPKB, PLSCR1, MMP14, MMP13, PAX8, IL1B, TNNT2, MED20, FJX1, CD44, IGHMBP2, COL19A1, FSTL3, RELB, NEURL1A, CUX1, LMNA, HSD17B2, CTNNA1, GCNT2, HAS2, CDKN2B, BIK, STAT1, IL34, MBD1, STAT3, AP3D1, SORBS2, KRT19, TTC7, NFIC, F2RL1, B9D1, CRLF1, CSF1, HP, TNC, AHR, CXCL13, FGF2, FGF4, COMP, SALL1, SALL3, CLEC5A, MEN1, SEMA6C, AGTPBP1, HGF, TPM1, TSC1, VASH1, PRSS56, FOXP1, SLC9B2, ADAM15, SMO, PKP2, PFKFB1, SLCO1A5, EFNB2, SOCS3, SBNO2, WNT2, SMAD1, TGFB1, VCAM1, VDR, PTCH2, MSN, INHBA, EFNA1, RCAN1, IL6, DAB2, PTPRC, BMP1, COL5A1, BCL6, SERPINB6B, IL7, FES, TRP53, MAFF, BCL3, SP5, NF2, NES, BCL2L1, FGFR1, BNC2, LRRK1, PTPN22, MSLN, LYL1, PPP1R13L, DACT2, ITGAV, INSL3, KDM6A, TGIF1, ARHGEF15, LSR, UTF1, DNM2, GREM1, VCAN, EFHC1, MYH4, DOCK2, CLRN1, LAMA5, LRP1, LRP2, TOB2, THBS1, PTHLH, THBS3, DNAJB6, RAB23, POC1A, CCL2, NCAM1, SLIT3, TNNI3, PDLIM5, CNNM4, IFI204, PRRX1, MBOAT7, PTPN11, LAMB1, RPGRIP1, MYO1E, LEP",585,3520,17152,1.6825485625485626,5.0679460628089146e-12,1.7401800603897885e-12,1.5791539349278524e-12
3,GOTERM_BP_5,GO:1902531~regulation of intracellular signal transduction,112,13.099415204678364,2.3112504398575143e-14,"CSF1, ULK4, WWC2, FGF2, FGF4, GJA1, SESN3, DHX58, PROK2, MEN1, HGF, IGFBP3, TSC1, MID1, TIAM2, DDIT3, MADD, S100A9, S100A8, IQGAP1, ZC3HAV1, RASAL2, DDX60, RASAL3, KALRN, RASGRP4, C3, SOCS3, PDCD10, PMAIP1, CCL21A, TGFB1, GADD45B, FN1, LIF, EIF2AK2, INHBA, GDF3, EFNA1, BST2, CXCL10, RCAN1, CXCL11, IL6, DAB2, DNMBP, PTPRC, BMP1, BCL6, TRP53, BCL3, NOX4, NF2, GPR18, BCL2L1, FGFR1, IGHM, CXCL9, SLC44A2, LRRK1, HSPB1, PTPN22, DUSP16, AKAP13, BDKRB2, CASP1, TIMP2, ANKRD1, ITGAV, LMCD1, IL11, ARHGEF12, PLEKHG2, ARHGEF15, ARHGEF19, TRAF2, NME5, GFRA2, DNM2, GREM1, ITPKB, PLSCR1, IL1B, PELI1, CDH13, ARHGEF1, ARHGEF2, DOCK2, CD44, BIRC3, HBEGF, NFAT5, CCL12, AKAP5, THBS1, FGD2, FGD4, CCL7, MARVELD3, GCNT2, CCL2, NCAM1, STAT1, STAT3, OSM, PTPN11, CDC42BPA, P2RX4, JSRP1, LEP, F2RL1, CRLF1",585,1552,17152,2.1158516168825448,8.784439842202119e-11,2.0519281494615532e-11,1.8620546719088545e-11
4,GOTERM_BP_5,GO:0007166~cell surface receptor signaling pathway,145,16.95906432748538,3.327269722645351e-14,"CSF1, SERPINE1, HP, PLAT, LDLRAD4, CXCL13, FGF2, FGF4, BAIAP2L1, SALL1, SALL3, MYC, EPHB2, MEN1, ZBP1, SEMA6C, IL1R2, NPFF, HGF, IGFBP3, ADAM10, TSC1, EREG, BTC, SMO, CCNY, ADAM15, DDIT3, CD109, MADD, COL4A6, COL4A5, INTU, IQGAP1, EFNB2, SOCS3, NCSTN, PDCD10, PMAIP1, WNT2, SPTBN1, CCL21A, WWTR1, SMAD1, TGFB1, FZD2, RCC2, FZD6, LIF, NFATC2, INHBA, GDF3, IIGP1, NFATC4, EFNA1, CXCL10, CXCL11, IL6, DAB2, COL1A2, PTPRC, BMP1, BCL6, IL7, FES, CILP, TRP53, CAPRIN2, LCN2, BCL2L1, FGFR1, DDR1, CSRNP1, IGHM, CXCL9, LRRK1, NKAP, HSPB1, PTPN22, CD3G, CHRDL1, TRIM6, DACT2, PMEPA1, CTLA4, ITGAV, CD37, BCL2A1A, KDM6A, TGIF1, EDN2, TNFRSF12A, WNT9B, TRAF2, WNT9A, OSMR, GFRA2, DNM2, GREM1, ITPKB, ENAH, ELF1, MMP14, CTTN, IL1B, IRF7, PELI1, CDH13, ITGA5, DBN1, CD44, HBEGF, LAMA5, CCL12, LRP1, THBS1, FSTL3, NKD2, NEURL1A, ACVR1C, CCL7, LMNA, CTNNA1, STAT4, GCNT2, CCL2, NCAM1, SLIT3, CDKN2B, PRRX1, STAT1, STAT2, STAT3, OSM, PTPN11, SORBS2, SORBS1, TSPAN15, MYO1E, KRT19, P2RX4, LRG1, LEP, F2RL1, B9D1",585,2278,17152,1.8662644544997489,1.2669865157022286e-10,2.0519281494615532e-11,1.8620546719088545e-11
5,GOTERM_BP_5,GO:0072358~cardiovascular system development,87,10.175438596491228,3.7758930195138993e-14,"ATF2, SERPINE1, HSPB1, AHR, ANTXR1, FGF2, LOXL1, ELK3, AKAP13, LYL1, GJA1, SALL1, PPP1R13L, RPS6KA2, SH3PXD2B, ANKRD1, PROK2, ITGAV, EPHB2, KDM6A, CXADR, TNFRSF12A, ARHGEF15, HGF, TPM1, TSC1, VASH1, EREG, RUNX1, FOXP1, DNM2, GREM1, VCAN, MMP14, CCDC80, MMP13, SMO, ADAM15, DDIT3, IL1B, TNNT2, PKP2, CDH13, ITGA5, HBEGF, CCL12, LRP1, LAMA4, LRP2, THBS1, EFNB2, C3, SOCS3, PDCD10, LMNA, HAS2, CCL2, NCAM1, TNNI3, PDLIM5, WNT2, SMAD1, TGFB1, FZD2, VCAM1, PRRX1, STAT1, MBD1, FN1, LIF, PTPN11, SORBS2, NR2F2, NFATC4, EFNA1, FOSL1, MYO1E, CXCL10, PTPRB, COL1A2, LRG1, COL5A1, TRP53, LEP, NOX4, B9D1, FGFR1",585,1062,17152,2.401892896808151,1.4359180511291922e-10,2.0519281494615532e-11,1.8620546719088545e-11
6,GOTERM_BP_5,GO:0072359~circulatory system development,87,10.175438596491228,3.7758930195138993e-14,"ATF2, SERPINE1, HSPB1, AHR, ANTXR1, FGF2, LOXL1, ELK3, AKAP13, LYL1, GJA1, SALL1, PPP1R13L, RPS6KA2, SH3PXD2B, ANKRD1, PROK2, ITGAV, EPHB2, KDM6A, CXADR, TNFRSF12A, ARHGEF15, HGF, TPM1, TSC1, VASH1, EREG, RUNX1, FOXP1, DNM2, GREM1, VCAN, MMP14, CCDC80, MMP13, SMO, ADAM15, DDIT3, IL1B, TNNT2, PKP2, CDH13, ITGA5, HBEGF, CCL12, LRP1, LAMA4, LRP2, THBS1, EFNB2, C3, SOCS3, PDCD10, LMNA, HAS2, CCL2, NCAM1, TNNI3, PDLIM5, WNT2, SMAD1, TGFB1, FZD2, VCAM1, PRRX1, STAT1, MBD1, FN1, LIF, PTPN11, SORBS2, NR2F2, NFATC4, EFNA1, FOSL1, MYO1E, CXCL10, PTPRB, COL1A2, LRG1, COL5A1, TRP53, LEP, NOX4, B9D1, FGFR1",585,1062,17152,2.401892896808151,1.4359180511291922e-10,2.0519281494615532e-11,1.8620546719088545e-11
7,GOTERM_BP_5,GO:0035556~intracellular signal transduction,149,17.42690058479532,4.967821645794717e-14,"CSF1, ULK4, WWC2, FGF2, FGF4, DOCK10, GJA1, SESN3, RPS6KA2, MYC, DHX58, PROK2, MEN1, HGF, IGFBP3, HMHA1, ANK2, TSC1, MID1, TIAM2, SMO, ADAM15, DDIT3, MADD, S100A9, KPNB1, S100A8, RRAD, NPR3, IQGAP1, ZC3HAV1, RASAL2, DDX60, RASAL3, KALRN, RASGRP4, C3, SOCS3, PDCD10, PMAIP1, CCL21A, WWTR1, SMAD1, TGFB1, VCAM1, GADD45B, FN1, LIF, NFATC2, ARHGAP29, EIF2AK2, INHBA, GDF3, DCLK1, NFATC4, EFNA1, BST2, CXCL10, RCAN1, CXCL11, IL6, DAB2, DNMBP, COL1A2, PTPRC, BMP1, BCL6, WNK1, TRP53, BCL3, NOX4, NF2, GPR18, BCL2L1, FGFR1, IGHM, CDKN1A, CXCL9, ARF2, SLC44A2, DOCK9, DOCK8, LRRK1, HSPB1, PTPN22, DUSP16, ING4, AKAP13, BDKRB2, CASP1, TIMP2, ANKRD1, ITGAV, BCL2A1A, LMCD1, IL11, ARHGEF12, EDN2, PLEKHG2, ARHGEF15, ARHGEF19, TRAF2, NME5, RHOF, GFRA2, DNM2, GREM1, ITPKB, PLSCR1, PLCB4, IL1B, PELI1, CDH13, ARHGEF1, ARHGEF2, DOCK2, CD44, BIRC3, HBEGF, NFAT5, CCL12, SAA3, AKAP5, THBS1, ADCY7, FGD2, RELB, FGD4, CCL7, RAB23, MARVELD3, GCNT2, CCL2, NCAM1, MAP4K5, MAP4K3, IFI204, STAT1, STAT3, OSM, PTPN11, CDC42BPA, P2RX4, JSRP1, RAB12, LEP, STK17B, F2RL1, CRLF1",585,2380,17152,1.835558428499605,1.8878099083963207e-10,2.362199192575388e-11,2.1436150401604207e-11
8,GOTERM_BP_5,GO:0009967~positive regulation of signal transduction,99,11.578947368421051,1.5821092811152602e-13,"CSF1, FGF2, FGF4, GJA1, SALL1, MYC, DHX58, PROK2, MEN1, ZBP1, RSAD2, HGF, IGFBP3, MID1, EREG, SMO, MADD, S100A9, S100A8, INTU, IQGAP1, ZC3HAV1, DDX60, RASGRP4, C3, PDCD10, PMAIP1, WNT2, CCL21A, TGFB1, GADD45B, LIF, EIF2AK2, INHBA, GDF3, NFATC4, EFNA1, BST2, CXCL10, CXCL11, IL6, DAB2, PTPRC, BMP1, TRP53, CAPRIN2, NOX4, GPR18, FGFR1, IGHM, CXCL9, SLC44A2, LRRK1, PTPN22, AKAP13, TRIM6, CASP1, TIMP2, ANKRD1, ITGAV, LMCD1, IL11, TNFRSF12A, TRAF2, WNT9A, GREM1, ITPKB, PLSCR1, IL1B, IRF7, PELI1, CDH13, DOCK2, DBN1, CD44, HBEGF, CCL12, AKAP5, THBS1, FGD2, NEURL1A, FGD4, CCL7, CTNNA1, GCNT2, CCL2, NCAM1, CDKN2B, PRRX1, BIK, STAT3, OSM, PTPN11, TSPAN15, P2RX4, LRG1, LEP, F2RL1, CRLF1",585,1328,17152,2.185727525486562,6.018185949585585e-10,6.687048561513833e-11,6.068268042677642e-11
9,GOTERM_BP_5,GO:0030334~regulation of cell migration,67,7.83625730994152,7.549777941798363e-13,"CXCL9, CSF1, SERPINE1, ULK4, HSPB1, LAMC2, PTPN22, LDLRAD4, CXCL13, FGF2, FGF4, DOCK10, MYC, ITGAV, TIMP1, INSL3, SEMA6C, EDN2, CAMK1D, HGF, IGFBP3, TPM1, ADAM10, VASH1, FOXP1, GREM1, MMP14, ADAM15, IL1B, PKP2, CDH13, ITGA5, VCL, HBEGF, LAMA5, CCL12, LRP1, LAMA4, IQGAP1, THBS1, ACVR1C, CCL7, PDCD10, LMNA, MARVELD3, GCNT2, HAS2, CCL2, CCL21A, TGFB1, RCC2, STAT3, FN1, MSN, LAMB1, NR2F2, BST2, EFNA1, CXCL10, CXCL11, DAB2, PTPRC, TRP53, NOX4, F2RL1, GPR18, FGFR1",585,742,17152,2.647462390858617,2.871836102258385e-09,2.871935529060097e-10,2.6061833455087945e-10
10,GOTERM_BP_5,GO:2000145~regulation of cell motility,69,8.070175438596491,9.509800789932828e-13,"CXCL9, CSF1, SERPINE1, ULK4, HSPB1, LAMC2, PTPN22, LDLRAD4, CXCL13, FGF2, FGF4, DOCK10, MYC, ITGAV, TIMP1, INSL3, SEMA6C, EDN2, CAMK1D, HGF, IGFBP3, TPM1, ADAM10, VASH1, FOXP1, GREM1, MMP14, ADAM15, IL1B, PKP2, CDH13, ITGA5, VCL, HBEGF, LAMA5, CCL12, LRP1, LAMA4, IQGAP1, THBS1, ACVR1C, CCL7, PDCD10, LMNA, MARVELD3, GCNT2, CTNNA1, HAS2, CCL2, CCL21A, TGFB1, RCC2, STAT3, FN1, MSN, LAMB1, NR2F2, BST2, EFNA1, CXCL10, CXCL11, DAB2, PTPRC, FES, TRP53, NOX4, F2RL1, GPR18, FGFR1",585,782,17152,2.587028657616893,3.61766883116843e-09,3.28866201862768e-10,2.984348393349829e-10
11,GOTERM_BP_5,GO:0010647~positive regulation of cell communication,102,11.929824561403509,1.0909147810579372e-11,"CSF1, FGF2, FGF4, GJA1, SALL1, MYC, DHX58, PROK2, MEN1, ZBP1, RSAD2, HGF, IGFBP3, MID1, EREG, RUNX1, SMO, MADD, S100A9, S100A8, INTU, IQGAP1, ZC3HAV1, DDX60, KALRN, RASGRP4, C3, PDCD10, PMAIP1, WNT2, CCL21A, TGFB1, GADD45B, LIF, EIF2AK2, INHBA, GDF3, NFATC4, EFNA1, BST2, CXCL10, CXCL11, IL6, DAB2, PTPRC, BMP1, TRP53, CAPRIN2, NOX4, GPR18, FGFR1, IGHM, CXCL9, SLC44A2, LRRK1, PTPN22, AKAP13, TRIM6, CASP1, TIMP2, ANKRD1, ITGAV, LMCD1, IL11, EDN2, TNFRSF12A, TRAF2, WNT9A, GREM1, ITPKB, PLSCR1, IL1B, IRF7, PELI1, CDH13, DOCK2, DBN1, CD44, HBEGF, CCL12, AKAP5, THBS1, FGD2, NEURL1A, FGD4, CCL7, CTNNA1, GCNT2, CCL2, NCAM1, CDKN2B, PRRX1, BIK, STAT3, OSM, PTPN11, TSPAN15, P2RX4, LRG1, LEP, F2RL1, CRLF1",585,1490,17152,2.00711753570814,4.1498453118293817e-08,3.458199855953661e-09,3.138198186843333e-09
12,GOTERM_BP_5,GO:1902533~positive regulation of intracellular signal transduction,73,8.538011695906434,1.3575322191606195e-11,"IGHM, CXCL9, CSF1, SLC44A2, LRRK1, PTPN22, FGF2, FGF4, AKAP13, GJA1, DHX58, CASP1, TIMP2, ANKRD1, PROK2, ITGAV, LMCD1, IL11, HGF, IGFBP3, TRAF2, MID1, ITPKB, GREM1, PLSCR1, IL1B, MADD, PELI1, CDH13, DOCK2, S100A9, CD44, S100A8, HBEGF, CCL12, IQGAP1, ZC3HAV1, AKAP5, DDX60, THBS1, RASGRP4, FGD2, C3, FGD4, CCL7, PDCD10, GCNT2, PMAIP1, CCL2, NCAM1, CCL21A, TGFB1, GADD45B, STAT3, OSM, LIF, EIF2AK2, PTPN11, BST2, EFNA1, CXCL10, CXCL11, IL6, DAB2, P2RX4, PTPRC, TRP53, LEP, NOX4, F2RL1, CRLF1, GPR18, FGFR1",585,905,17152,2.3650110969447984,5.164067973240095e-08,3.972348124374613e-09,3.6047701696480445e-09
13,GOTERM_BP_5,GO:0001944~vasculature development,60,7.017543859649122,3.1492663890427054e-11,"SERPINE1, HSPB1, AHR, ANTXR1, FGF2, LOXL1, ELK3, LYL1, GJA1, PROK2, ITGAV, EPHB2, TNFRSF12A, ARHGEF15, HGF, VASH1, EREG, RUNX1, DNM2, GREM1, MMP14, CCDC80, SMO, ADAM15, DDIT3, IL1B, CDH13, ITGA5, HBEGF, CCL12, LRP1, LAMA4, LRP2, THBS1, EFNB2, C3, SOCS3, PDCD10, HAS2, CCL2, TNNI3, WNT2, TGFB1, PRRX1, STAT1, FN1, LIF, NR2F2, NFATC4, EFNA1, FOSL1, MYO1E, CXCL10, PTPRB, COL1A2, LRG1, COL5A1, LEP, B9D1, FGFR1",585,677,17152,2.598492595538385,1.197982134604203e-07,8.063161566014063e-09,7.317043566214655e-09
14,GOTERM_BP_5,GO:0001568~blood vessel development,58,6.783625730994151,3.179480112781571e-11,"SERPINE1, HSPB1, AHR, ANTXR1, FGF2, LOXL1, ELK3, LYL1, GJA1, PROK2, ITGAV, EPHB2, TNFRSF12A, HGF, VASH1, EREG, RUNX1, DNM2, GREM1, MMP14, CCDC80, SMO, ADAM15, DDIT3, IL1B, CDH13, ITGA5, HBEGF, CCL12, LRP1, LAMA4, LRP2, THBS1, EFNB2, C3, SOCS3, PDCD10, HAS2, CCL2, TNNI3, WNT2, TGFB1, PRRX1, STAT1, FN1, LIF, NR2F2, NFATC4, EFNA1, FOSL1, MYO1E, CXCL10, PTPRB, COL1A2, LRG1, COL5A1, LEP, FGFR1",585,641,17152,2.6529487846180517,1.2094737011913992e-07,8.063161566014063e-09,7.317043566214655e-09
15,GOTERM_BP_5,GO:0071345~cellular response to cytokine stimulus,52,6.081871345029239,4.9114920502139185e-11,"CXCL9, CSF1, SERPINE1, CXCL13, IFIT1, TRIM6, MYC, ANKRD1, ZBP1, EDN2, IL1R2, TRAF2, OSMR, EREG, PLSCR1, IL1B, IRF7, GM4951, DBN1, CD44, BIRC3, OTUB1, CALCA, CCL12, SAA3, THBS1, SOCS3, SBNO2, CCL7, STAT4, HAS2, CCL2, SLIT3, ST3GAL6, PCK1, CCL21A, VCAM1, IFI204, STAT1, STAT2, STAT3, FN1, OSM, IFI202B, IIGP1, CXCL10, CXCL11, IL6, PTPRC, LEP, LCN2, F2RL1",585,542,17152,2.812956129561296,1.868331928056577e-07,1.1677072349383592e-08,1.059654409833653e-08
16,GOTERM_BP_5,GO:0048468~cell development,135,15.789473684210526,6.383974037452179e-11,"CSF1, ULK4, TNC, LDLRAD4, FGF2, ANTXR1, GJA1, SALL1, SALL3, RPS6KA2, MYC, CLEC5A, EPHB2, MEN1, CDK5RAP2, SOX5, SEMA6C, PRM2, CXADR, HGF, ACTN1, TPM1, RFX2, ACSL4, ANK2, FNDC3A, EREG, SLC9B2, RUNX1, FOXP1, CLDN3, SMO, ADAM15, ZSCAN21, S100A9, VCL, S100A8, CALCA, IQGAP1, KALRN, EFNB2, MAP4, WNT2, CCL21A, WWTR1, TGFB1, FZD2, RCC2, FN1, LIF, MSN, NFATC2, INHBA, GDF3, DCLK1, NFATC4, EFNA1, CYP26A1, RCAN1, IL6, DAB2, PTPRC, BMP1, BCL6, FES, TRP53, CAPRIN2, NF2, HOXD9, BCL2L1, FGFR1, DDR1, CDKN1A, SPEF2, LRRK1, HSPB1, LAMC1, TFCP2L1, AKAP13, ENC1, TIMP2, DACT2, ANKRD1, ITGAV, INSL3, TGIF1, CAMK1D, TNFRSF12A, WNT9B, LSR, NME5, IQCG, DNM2, GREM1, ENAH, PAX8, CTTN, PEAK1, IL1B, TNNT2, ARHGEF2, MYH4, DBN1, CD44, CLRN1, LAMA5, LRP1, AKAP5, PTHLH, NEURL1A, CUX1, LMNA, POC1A, CTNNA1, GCNT2, HAS2, NCAM1, SLIT3, FLNC, PDLIM5, CDKN2B, PRRX1, STAT1, MBD1, STAT3, PTPN11, LAMB1, SORBS2, RPGRIP1, MYO1E, KRT19, RSPH1, LEP, TTC3, F2RL1",585,2278,17152,1.737556561085973,2.428462322345837e-07,1.428508072851064e-08,1.2963222574873484e-08
17,GOTERM_BP_5,GO:0060326~cell chemotaxis,34,3.976608187134503,8.201547520314851e-11,"CCL12, CALCA, CXCL9, CSF1, SAA3, SERPINE1, HSPB1, CXCL13, THBS1, FGF2, FGF4, CCL7, CCL2, CCL21A, CAMK1D, EDN2, VCAM1, CXADR, HGF, ADAM10, IL16, GREM1, CXCL10, CH25H, CXCL11, IL1B, SAA1, F2RL1, SAA2, S100A9, GPR18, S100A8, HBEGF, FGFR1",585,261,17152,3.819419065396077,3.11986934287134e-07,1.7332603759598722e-08,1.5728745577848262e-08
18,GOTERM_BP_5,GO:0009887~organ morphogenesis,76,8.88888888888889,4.435453505999535e-10,"DDR1, ATF2, CSRNP1, SPEF2, CSF1, TNC, AHR, FGF2, FGF4, COMP, GJA1, SALL1, PPP1R13L, MYC, ANKRD1, ITGAV, EPHB2, MEN1, KDM6A, AGTPBP1, HGF, TPM1, WNT9B, WNT9A, EREG, GREM1, MMP14, MMP13, SMO, PAX8, ADAM15, TNNT2, SIK3, PKP2, FJX1, CD44, CLRN1, LAMA5, THBS1, PTHLH, THBS3, EFNB2, RAB23, POC1A, CTNNA1, HAS2, TNNI3, SLIT3, WNT2, CNNM4, WWTR1, CDSN, TGFB1, FZD2, PRRX1, VDR, STAT1, FZD6, STAT3, LIF, MSN, LAMB1, INHBA, EFNA1, RPGRIP1, IL6, DAB2, COL1A2, COL5A1, IL7, TRP53, NFIC, SP5, NF2, HOXD9, FGFR1",585,1038,17152,2.1467187062562787,1.6872449423166458e-06,8.880244808853805e-08,8.05851868563705e-08
19,GOTERM_BP_5,GO:0043067~regulation of programmed cell death,96,11.228070175438596,1.7816077648202682e-09,"ATF2, CDKN1A, BNC2, DOCK8, SERPINE1, HSPB1, CD3G, FGF2, FGF4, COMP, ING4, AIFM2, RPS6KA2, MYC, CLEC5A, BDKRB2, CASP1, ANKRD1, CTLA4, PROK2, ITGAV, TIMP1, BCL2A1A, INSL3, MEN1, CAMK1D, TNFRSF12A, HGF, IGFBP3, TRAF2, ANK2, NME5, WNT9A, FOXP1, ITPKB, BTC, GREM1, PLSCR1, SHQ1, SMO, FNDC1, PAX8, CTTN, DDIT3, IL1B, MADD, EFHC1, ITGA5, S100A9, CD44, S100A8, BIRC3, CCL12, LRP1, THBS1, NEURL1A, SOCS3, ACVR1C, DNAJB6, PDCD10, LMNA, CTNNA1, PMAIP1, CCL2, CCL21A, TGFB1, GADD45B, VDR, BIK, STAT1, STAT3, FN1, OSM, EIF2AK2, INHBA, GDF3, IFI202B, CIDEC, NFATC4, EFNA1, FOSL1, IL6, DAB2, PTPRC, BMP1, BCL6, IL7, TRP53, LEP, STK17B, BCL3, NOX4, NES, CRLF1, BCL2L1, FGFR1",585,1498,17152,1.878963404197049,6.777212922415288e-06,3.3700728017067614e-07,3.0582258968169666e-07
20,GOTERM_BP_5,GO:0019220~regulation of phosphate metabolic process,102,11.929824561403509,1.8604502848538902e-09,"TSKS, CSF1, ULK4, LDLRAD4, ZFYVE1, FGF2, FGF4, MYC, PROK2, MEN1, HGF, IGFBP3, TSC1, MID1, EREG, SYTL2, FNDC1, CCNY, CD109, MADD, CD2BP2, PFKFB1, CALCA, NPR3, IQGAP1, C3, SOCS3, PDCD10, CCL21A, WWTR1, TGFB1, FZD2, GADD45B, FN1, LIF, EIF2AK2, NR2F2, INHBA, GDF3, EFNA1, CXCL10, RCAN1, CXCL11, IL6, DAB2, PTPRC, BMP1, WNK1, TRP53, CAPRIN2, NOX4, NF2, FGFR1, IGHM, CDKN1A, CXCL9, MCM7, LRRK1, HSPB1, PTPN22, DUSP16, AKAP13, TRIM6, BDKRB2, TIMP2, PMEPA1, ITGAV, INSL3, IL11, WNT9B, TRAF2, GFRA2, GREM1, ITPKB, VCAN, IL1B, ITGA5, ARHGEF2, CD44, BIRC3, HBEGF, CCL12, AKAP5, THBS1, ADCY7, PTHLH, FGD2, NEURL1A, FGD4, CCL7, MARVELD3, GCNT2, CCL2, CDKN2B, STAT2, IL34, STAT3, OSM, PTPN11, LEP, F2RL1, CRLF1",585,1632,17152,1.8324786324786324,7.077127670118699e-06,3.3700728017067614e-07,3.0582258968169666e-07
21,GOTERM_BP_5,GO:0042981~regulation of apoptotic process,95,11.11111111111111,2.118250637198714e-09,"ATF2, CDKN1A, BNC2, DOCK8, SERPINE1, HSPB1, CD3G, FGF4, COMP, ING4, AIFM2, RPS6KA2, MYC, CLEC5A, BDKRB2, CASP1, ANKRD1, CTLA4, PROK2, ITGAV, TIMP1, BCL2A1A, INSL3, MEN1, CAMK1D, TNFRSF12A, HGF, IGFBP3, TRAF2, ANK2, NME5, WNT9A, FOXP1, ITPKB, BTC, GREM1, PLSCR1, SHQ1, SMO, FNDC1, PAX8, CTTN, DDIT3, IL1B, MADD, EFHC1, ITGA5, S100A9, CD44, S100A8, BIRC3, CCL12, LRP1, THBS1, NEURL1A, SOCS3, ACVR1C, DNAJB6, PDCD10, LMNA, CTNNA1, PMAIP1, CCL2, CCL21A, TGFB1, GADD45B, VDR, BIK, STAT1, STAT3, FN1, OSM, EIF2AK2, INHBA, GDF3, IFI202B, CIDEC, NFATC4, EFNA1, FOSL1, IL6, DAB2, PTPRC, BMP1, BCL6, IL7, TRP53, LEP, STK17B, BCL3, NOX4, NES, CRLF1, BCL2L1, FGFR1",585,1482,17152,1.8794652640806488,8.057793153715131e-06,3.662647919956323e-07,3.323727818004529e-07
22,GOTERM_BP_5,GO:0007167~enzyme linked receptor protein signaling pathway,63,7.368421052631578,3.634590883493092e-09,"DDR1, CSRNP1, CSF1, HSPB1, PLAT, LDLRAD4, FGF2, CHRDL1, FGF4, BAIAP2L1, DACT2, PMEPA1, EPHB2, MEN1, TGIF1, HGF, IGFBP3, ADAM10, TSC1, GFRA2, EREG, DNM2, BTC, GREM1, IL1B, CD109, COL4A6, CDH13, COL4A5, HBEGF, LRP1, IQGAP1, THBS1, FSTL3, EFNB2, NEURL1A, SOCS3, ACVR1C, GCNT2, CCL2, SPTBN1, WWTR1, SMAD1, CDKN2B, TGFB1, STAT1, STAT3, LIF, PTPN11, SORBS1, INHBA, GDF3, EFNA1, MYO1E, DAB2, COL1A2, LRG1, BMP1, CILP, FES, TRP53, LEP, FGFR1",585,824,17152,2.2416728902165795,1.3825888041996135e-05,6.011297269916401e-07,5.455046839051371e-07
23,GOTERM_BP_5,GO:0050921~positive regulation of chemotaxis,22,2.5730994152046787,3.805647787778176e-09,"CXCL9, TGFB1, EDN2, CAMK1D, CSF1, SERPINE1, FN1, HSPB1, ADAM10, IL16, CXCL13, THBS1, FGF2, CXCL10, CXCL11, CCL7, IL1B, CCL2, CDH13, F2RL1, CCL21A, FGFR1",585,132,17152,4.886609686609686,1.4476579460298566e-05,6.031951743628409e-07,5.47379006808761e-07
24,GOTERM_BP_5,GO:0000902~cell morphogenesis,84,9.824561403508772,9.089126657716696e-09,"DDR1, SPEF2, ULK4, LDLRAD4, LAMC1, TFCP2L1, AHR, ANTXR1, GJA1, SALL1, 1110004E09RIK, DACT2, ITGAV, EPHB2, SEMA6C, TNFRSF12A, HGF, ACTN1, TPM1, WNT9B, RFX2, NME5, IQCG, FOXP1, DNM2, GREM1, ENAH, CLDN3, SMO, PAX8, ADAM15, CTTN, PEAK1, ARHGEF2, DBN1, VCL, CLRN1, LAMA5, CCL12, INTU, IQGAP1, AKAP5, KALRN, SPATA6, EFNB2, NEURL1A, FGD4, CCL7, CUX1, RAB23, GCNT2, POC1A, HAS2, CCL2, NCAM1, SLIT3, MAP4, PDLIM5, WNT2, WWTR1, TGFB1, MYO10, VDR, STAT1, RCC2, FN1, LIF, MSN, LAMB1, PTPN11, DCLK1, NFATC4, EFNA1, IL6, DAB2, RSPH1, BCL6, FES, TTC3, CAPRIN2, CEP162, NOX4, B9D1, NES",585,1283,17152,1.919603493414873,3.457444031351731e-05,1.3830015122381724e-06,1.2550266088975214e-06
25,GOTERM_BP_5,GO:0009615~response to virus,37,4.32748538011696,1.0373286756268711e-08,"SLFN8, CXCL9, REP15, OAS1A, HSPB1, OAS1B, PTPN22, ZC3HAV1, DDX60, IFIT1, TRIM6, HIST1H3A, DHX58, PMAIP1, LMCD1, OASL1, OASL2, ZBP1, RSAD2, STAT2, MX1, EIF2AK2, GTF2F1, DCLK1, ISG20, BST2, CXCL10, IL6, PLSCR1, PTPRC, POLR3B, OAS2, BCL3, LCN2, F2RL1, TRIM34A, BCL2L1",585,364,17152,2.9802949187564574,3.945920460035613e-05,1.4507272790383237e-06,1.3164854277708444e-06
26,GOTERM_BP_5,GO:0010562~positive regulation of phosphorus metabolic process,73,8.538011695906434,1.0678329078094914e-08,"IGHM, CDKN1A, CXCL9, CSF1, LRRK1, PTPN22, FGF2, FGF4, AKAP13, TRIM6, MYC, TIMP2, PROK2, ITGAV, INSL3, IL11, HGF, IGFBP3, TRAF2, MID1, GFRA2, EREG, GREM1, CCNY, FNDC1, IL1B, MADD, ITGA5, ARHGEF2, CD44, HBEGF, PFKFB1, CALCA, CCL12, IQGAP1, AKAP5, THBS1, ADCY7, PTHLH, FGD2, NEURL1A, C3, FGD4, CCL7, PDCD10, GCNT2, CCL2, CCL21A, TGFB1, FZD2, GADD45B, IL34, STAT3, OSM, LIF, EIF2AK2, PTPN11, INHBA, GDF3, EFNA1, CXCL10, CXCL11, IL6, DAB2, PTPRC, BMP1, TRP53, LEP, CAPRIN2, NOX4, F2RL1, CRLF1, FGFR1",585,1053,17152,2.032606878190924,4.06195391549069e-05,1.4507272790383237e-06,1.3164854277708444e-06
27,GOTERM_BP_5,GO:0045937~positive regulation of phosphate metabolic process,73,8.538011695906434,1.0678329078094914e-08,"IGHM, CDKN1A, CXCL9, CSF1, LRRK1, PTPN22, FGF2, FGF4, AKAP13, TRIM6, MYC, TIMP2, PROK2, ITGAV, INSL3, IL11, HGF, IGFBP3, TRAF2, MID1, GFRA2, EREG, GREM1, CCNY, FNDC1, IL1B, MADD, ITGA5, ARHGEF2, CD44, HBEGF, PFKFB1, CALCA, CCL12, IQGAP1, AKAP5, THBS1, ADCY7, PTHLH, FGD2, NEURL1A, C3, FGD4, CCL7, PDCD10, GCNT2, CCL2, CCL21A, TGFB1, FZD2, GADD45B, IL34, STAT3, OSM, LIF, EIF2AK2, PTPN11, INHBA, GDF3, EFNA1, CXCL10, CXCL11, IL6, DAB2, PTPRC, BMP1, TRP53, LEP, CAPRIN2, NOX4, F2RL1, CRLF1, FGFR1",585,1053,17152,2.032606878190924,4.06195391549069e-05,1.4507272790383237e-06,1.3164854277708444e-06
28,GOTERM_BP_5,GO:0016310~phosphorylation,118,13.801169590643276,1.2481682013956564e-08,"CSF1, ULK4, BUB1B, LDLRAD4, FGF2, ENO3, ENO4, FGF4, PPIP5K1, RPS6KA2, MYC, PROK2, EPHB2, MEN1, HGF, IGFBP3, ADAM10, TSC1, MID1, EREG, FNDC1, CCNY, CD109, MADD, SIK3, PFKFB1, CALCA, IQGAP1, KALRN, C3, SOCS3, PDCD10, GRK4, TRPM6, SPTBN1, CCL21A, CDK17, WWTR1, SMAD1, TGFB1, GADD45B, FN1, LIF, EIF2AK2, NR2F2, INHBA, GDF3, DCLK1, EFNA1, IL6, DAB2, PTPRC, BMP1, FES, WNK1, TRP53, CAPRIN2, NOX4, NF2, FGFR1, DDR1, IGHM, CDKN1A, LRRK1, ADK, HSPB1, PTPN22, DUSP16, AKAP13, TRIM6, BDKRB2, TIMP2, PMEPA1, ITGAV, IL11, CAMK1D, WNT9B, TRAF2, NME5, GFRA2, GREM1, ITPKB, PEAK1, IL1B, HKDC1, ITGA5, ARHGEF2, CD44, BIRC3, HBEGF, CCL12, SAA3, AKAP5, THBS1, FGD2, NEURL1A, FGD4, ACVR1C, CCL7, MARVELD3, STAT4, GCNT2, CCL2, MAP4K5, MAP4K3, CDKN2B, STAT2, IL34, STAT3, OSM, PTPN11, CDC42BPA, GTF2H4, NAGK, LEP, STK17B, F2RL1, CRLF1",585,2063,17152,1.677033280717236,4.747919153280655e-05,1.6372523579686474e-06,1.4857505624888986e-06
29,GOTERM_BP_5,GO:0051272~positive regulation of cellular component movement,43,5.029239766081871,1.3837242254287992e-08,"CCL12, CXCL9, CSF1, SERPINE1, HSPB1, LAMC2, IQGAP1, CXCL13, THBS1, FGF2, CCL7, PDCD10, MYC, GCNT2, CCL2, HAS2, ITGAV, INSL3, CCL21A, SEMA6C, CAMK1D, TGFB1, EDN2, HGF, FN1, ADAM10, LAMB1, FOXP1, CXCL10, CXCL11, DAB2, MMP14, PTPRC, BCL6, RNF207, TRP53, IL1B, CDH13, F2RL1, NOX4, ITGA5, HBEGF, FGFR1",585,472,17152,2.67107054903665,5.2635484552920886e-05,1.7545623178437171e-06,1.5922053420600717e-06
30,GOTERM_BP_5,GO:0001819~positive regulation of cytokine production,37,4.32748538011696,1.7046570476747302e-08,"ATF2, SERPINE1, HSPB1, ZBTB20, PTPN22, ZC3HAV1, DDX60, THBS1, C3, TRIM6, DHX58, CLEC5A, CASP1, CCL2, SPTBN1, TGFB1, RSAD2, HGF, EIF2AK2, TRAF2, IL17RB, NFATC4, RUNX1, EREG, CD2, IL6, POLR3B, NLRP10, LEP, DDIT3, IL1B, BCL3, IRF7, PELI1, F2RL1, ARHGEF2, ULBP1",585,371,17152,2.9240629391572788,6.484305228937615e-05,2.091779164307959e-06,1.8982181059913447e-06
31,GOTERM_BP_5,GO:0001501~skeletal system development,44,5.146198830409357,2.3875337415597932e-08,"CSRNP1, SPEF2, NPR3, LRRK1, THBS1, FGF2, PTHLH, THBS3, FGF4, COMP, AKAP13, RAB23, MYC, SH3PXD2B, POC1A, HAS2, TIMP1, MEN1, SOX5, SMAD1, TGFB1, PRRX1, VDR, WNT9B, PTPN11, WNT9A, GDF3, RUNX1, FOXP1, SLC9B2, GREM1, VCAN, MMP14, PTPRC, MMP13, COL1A2, BMP1, LEP, ETL4, SIK3, SP5, HOXD9, CD44, FGFR1",585,499,17152,2.5853005155610367,9.08176602807398e-05,2.8381807352792035e-06,2.5755520237076267e-06
